,comment
632,which lives theyre not giving potentially deadly medicine to some healthy guy on the street in an attempt to save the lives of their patients in the icu the trolley question is concerned with whether intervening to consciously choose to end the life of someone else who has no say in the matter is justified to save multiple people who would otherwise have died from events over which the chooser had no role in creating not whether its justified to intervene to save said lives by taking actions which might result in ending them in some different fashion but could possibly spare one or more of them in the process
633,in the path of a runaway train car are five railway workmen who will surely be killed unless you a bystander do something if you flip a switch the train will be diverted onto a set of tracks in need of repair the train will be derailed and go down a hill across a road and into a mans yard the owner sleeping in his hammock will be killed in this situation would you fl ip the switch as usual its broad and vague you dont know that the five workmen made a mistake they work there youd expect to see them on the tracks and you dont even know if it was their choice to be there they may have been ordered to be there you could only justify the kill five people utilitarian view here if you filled in the gaps with information you made up the scenario is almost identical to the original version it shouldnt warrant a wildly different response to opinion polls
634,i wasnt meaning that in a way that i thought you were wrong or anything i just imaged the number to be way higher id never looked it up ive got a lot of firefighters in my family and feel like i hear about a fatal crash daily guess i assumed wrong
635,but that glitch will happen way less often than idiots causing accidents and the more cars are autonomous the less random factors happen thus less unpredictable bugglitch thus less accidents
636,once we actually reach fully self driving vehicles they will be designed completely differently than todays vehicles the safety of people inside will probably be a much greater part of the design so crashes are going to be less dangerous for the passengers anyway i feel like this problem is overblown by people thinking that the cars will look and be designed the same way they are now
637,once we actually reach fully self driving vehicles they will be designed completely differently than todays vehicles the safety of people inside will probably be a much greater part of the design so crashes are going to be less dangerous for the passengers anyway i feel like this problem is overblown by people thinking that the cars will look and be designed the same way they are now
638,this whole damned debate is moot some philosophers pondered whether an ai should analyze potential victims and survival rates like i robot and theorized a debate over what the criteria should be self driving cars will react to avoid an accident by driving within appropriate reacting distance you should not be driving faster than you can see to stop we as humans think were awesome and drive as we see fit tailgating like a mofo at mph so we philosophically believe that any sort of technology needs to trade off efficiency with usability leading to the debate about who needs to die first but really as per drivers ed and actual research we should be driving to allow enough time and distance to stop if the car in front of us stops self driving cars can actually adhere to this and thereby avoid unavoidable accidents by following the correct guidelines
639,this whole damned debate is moot some philosophers pondered whether an ai should analyze potential victims and survival rates like i robot and theorized a debate over what the criteria should be self driving cars will react to avoid an accident by driving within appropriate reacting distance you should not be driving faster than you can see to stop we as humans think were awesome and drive as we see fit tailgating like a mofo at mph so we philosophically believe that any sort of technology needs to trade off efficiency with usability leading to the debate about who needs to die first but really as per drivers ed and actual research we should be driving to allow enough time and distance to stop if the car in front of us stops self driving cars can actually adhere to this and thereby avoid unavoidable accidents by following the correct guidelines
640,i hate this argument the car will prioritize the rules of the road first that dramatically limits what the car can or cannot do in a collision and the choosing who lives and dies argument largely goes away eg a rear end collision is imminent driving into the sidewalk would avoid the crash even if the sidewalk is clear it shouldnt do it and just try to stop as fast as possible even though it means a collision
641,i hate this argument the car will prioritize the rules of the road first that dramatically limits what the car can or cannot do in a collision and the choosing who lives and dies argument largely goes away eg a rear end collision is imminent driving into the sidewalk would avoid the crash even if the sidewalk is clear it shouldnt do it and just try to stop as fast as possible even though it means a collision
642,lots of people just need something to hang on to in the belief they are actually better than a machine at driving and hide behind the convenient trolley problem to claim superiority they dont want to become outdated and inferior because in reality most accidents will happen because of inattentiveness intoxicating not following rules and do intuitive but fatal reactions humans will somehow make the car skid sideways and kill both the blind man and the child admitting were going to be outclassed is hard well until some insurance company somehow figures they can get the same settlement uber had to pay for any car accident with the excuse you are suppose to be better than a machine and causing an accidents will bankrupt you
643,lots of people just need something to hang on to in the belief they are actually better than a machine at driving and hide behind the convenient trolley problem to claim superiority they dont want to become outdated and inferior because in reality most accidents will happen because of inattentiveness intoxicating not following rules and do intuitive but fatal reactions humans will somehow make the car skid sideways and kill both the blind man and the child admitting were going to be outclassed is hard well until some insurance company somehow figures they can get the same settlement uber had to pay for any car accident with the excuse you are suppose to be better than a machine and causing an accidents will bankrupt you
644,isnt just brake kindasorta a trolley problem you could think of dozens of scenarios where instead of just break a human driver might swerve left and choose to side swipe another vehicle instead of running over a bunch of children playing in the street but the just break ai just breaks and so your car kills a bunch of kids
645,i think the question is regarding when the system fails and somebody dies computers are going to fail thats inevitable
646,not spot on actually the statement if it hits someone a person would have hit that someone is patently incorrect particularly in these the early days of the technology anyone who has built out anything of the type be it facial recognition or text to speech will admonish you for the pitfalls of that thinking yes it will be safer in aggregate and yes it will often prevent accidents that a human being would not have but it is absolutely going to kill a bunch of people where if you had a reasonable driver behind the wheel there is no way they make that mistake
647,not spot on actually the statement if it hits someone a person would have hit that someone is patently incorrect particularly in these the early days of the technology anyone who has built out anything of the type be it facial recognition or text to speech will admonish you for the pitfalls of that thinking yes it will be safer in aggregate and yes it will often prevent accidents that a human being would not have but it is absolutely going to kill a bunch of people where if you had a reasonable driver behind the wheel there is no way they make that mistake
648,when i was getting my drivers licence thats what my instructor old me you should just brake try to change lanes and break at the same time or just change lanes without looking and youll likely cause another worst accident
649,imagine sueing god lightning destroys your home or kills a family member you decide to sue god by proxy the church literally the only legal defence would be for the church to prove that god doesnt exist fun
650,which is exactly why they will always prioritize their own inhabitants its also why it would actually be immoral to design a self driving car that didnt prioritize its own inhabitants because discouraging even a few people from buying self driving cars could potentially kill many
651,because in reality most accidents will happen because of inattentiveness intoxicating not following rules and do intuitive but fatal reactions humans will somehow make the car skid sideways and kill both the blind man and the child dont forget bad urban planning
652,because in reality most accidents will happen because of inattentiveness intoxicating not following rules and do intuitive but fatal reactions humans will somehow make the car skid sideways and kill both the blind man and the child dont forget bad urban planning
653,youre reading the words and missing the point if it swerves its going to be a controlled swerve the same kind recommended in driving courses its never going to jump a curb onto a side walk or drive headfirst into oncoming traffic to avoid someone who steps into the road if people illegally walk into the road and there is person on the side and oncoming car with no one even in it the car will brake and hopefully only kill a few of the people who broke the law
654,hmm is that because killing people here is more utilitarian or because killing a sleeping person makes you more guilty of a crime
655,can you prove theyre not killing more people than theyre saving
656,thats what you have redundant sensors for aircraft parts are fly to fail because when one fails you have a backup if you have redundant sensors in the car then as soon as one goes out the car will auto drive itself to a maintenance location within x hours tbd timeframe based on reliability studies for sensor life you drive yourself to the hospital when one eye is blinded because you dont expect your second eye to go blind in the next half hour
657,people i this thread are not thinking deeply enough not all collisions are fatal sometimes a driver might just be firmly shaken or perhaps only gently tapped do you want your car to prioritize you not getting gently tapped ahead of killing someone else real world example pedestrian appears ahead of your car suddenly your car correctly calculates that it can avoid killing the pedestrian by braking hard but it also calculates you will may be rear ended by a trailing that is following too close if you brake a collision that in theory might kill you but almost certainly will be no worse than bruises and might not happen at all if the rear driver is alert enough do you still want the car to run down the pedestrian
658,but then what if my car tries to protect me at the expense of you and your car tries to protect you at the expense of me or some other driver do our cars start fighting or do poor people with shittier smart cars get killed by rich people with newer smarter smart cars the apocalypse better get here quick cuz the future is looking crazy
659,if prioritizing the inhabitants life kills though thats immoral
660,honest question how many wrecks have you been in not trying to argue against your point but if a car is going fast enough to actually hit a tree instead of stoppibg short of it then its traveling fast enough to grievously injure or kill its occupant between thingsdebris entering into the vehicle and the inertia of a thousand pound vehicle coming to a sudden stop no internal safety component can guarantee injury prevention
661,oh so we agree that it wont just brake then great but once evasive maneuvers are on the table as of course they will be then were already in the realm of having to design algorithms that must factor in risk probabilities how clear does the next lane over have to be for the car to make the lane change percent safe then some collisions will happen that could have been avoided or some lower number that minimizes total expected accidents over time but now the car will subject its occupants to risky emergency lane changes rather than gunning down pedestrians in its path and bam now were in trolley problem land
662,simply because there is ample opportunity to consult those persons and let them make their own choices this still doesnt argue in favor of the utilitarian viewpoint you are asserting that there is some value in the opinions of the people who are going to die this is different from saying you do what will statistically result in the least number of deaths even so this doesnt take into account organ harvesting which truly is immediately necessary maybe two people really need organs right now and there is a healthy person in the lobby we can carve up
663,thats exactly the point if the car following you was self drivung it would have a safe following distance and neithet the pedestrian or any of the people in any of the cars are hurt at the most you might have spilled some coffee the accident here would be rear ending and human error
664,what if we got rid of human based weaknesses for example humans need windows to see in a hypothetical ai driven vehicle those become expensive weak points why not make a car with no windows to lessen the risk of penetration in a crash why have all seats face forward when you could have rear facing seating so a deceleration pushes you back into a seat cushion rather than forwards into a dashboard or through a window why not have point restraints rather than point restraints and airbags at face or chest height to reduce distance to impact if you dont have to put glass there if a human being doesnt have to waste hours of their time driving can cars go at slower safer speeds id be fine only going if i can use the computer while i do if computers have better reflexes than humans can we go faster i think a big part of ai car design will be getting over the artificial restrictions imposed by our understanding of cars as driven once we decouple their design from the requirements of a human driver well do much better in terms of safety
665,ive been in a couple of wrecks that totaled the car i was in i was driving in one and a passenger in the other i had no injuries beyond a scrape on my chin from the airbag and some minor aches and pains i was also once hit by a car going about miles an hour which caused me to roll over the hood i was legally crossing at a crosswalk when the guy turned onto the road without looking my aches and pains were about times worse than my previous car accidents and i also had a concussion which caused headaches difficulty concentration and poor memory for about two weeks and i had extreme anxiety over the idea that my brain might never work the same again i would sure as hell prefer to be in a car that hits a tree than be in a car that hits a person cars are designed to minimize the force of the impact to the passengers and i would rather take my chances that those safety features wont protect me than mow down a person with zero protection knowing first hand how little it takes to cause them damage
666,a friend of mine hit a stream light that was sitting on a cement cylinder at about mph and he was fine i hit a sign going about the same speed and was also fine neither of us could stop but neither was gravely injured either reducing the impulse from a collision is what airbags are for the car should be able to sense a branch sticking out of the tree that would impale the driver but probably couldnt tell if a tree might fall on the car after being struck by it but then you have your trolley problem again its interesting to think about would we start charging reckless pedestrians with manslaughter if they jumped in front of one of these cars and its algorithm killed the driver or should we have the car strike the pedestrian maybe we can write two algorithms and have the owner choose
667,ive been in a lot of accidents only one of which was an impact at any serious speed the rest were between and kmshour because typically theres time to react just not enough to totally avoid the collision so dodging some kids on the road and hitting a tree at low speed in my mind is more likely than hitting that tree with speed and id much rather the tree than a group of kids the chances of injury to me are low the kids however
668,honest question how many wrecks have you been in not trying to argue against your point but if a car is going fast enough to actually hit a tree instead of stoppibg short of it then its traveling fast enough to grievously injure or kill its occupant its quite likely that the car will be able to reduce the speed somewhat even if not completely in addition the car sees it coming and will be able to activate all security measures like airbags well on time
669,my background is in developing algorithms for data analysis banking and investments but my programming skills amount to a well trained script kiddie at best so im finding it quite difficult simply from a programming perspective i understand the concepts at a much higher level than my educators but stumble hard on implementation i think most programs ive looked into teach the concepts well but infosec is a lot more commoditized than machine learning so if you dont plan to rise to the top youll have more demand and opportunity in infosec with a basic level of understanding everyone needs a secure database but few people need a simple neural network would you happen to have any recommendations for learning to program more as a subconscious reflex im very goal oriented so doing more exercises for the sake of exercises kills me inside python
670,my background is in developing algorithms for data analysis banking and investments but my programming skills amount to a well trained script kiddie at best so im finding it quite difficult simply from a programming perspective i understand the concepts at a much higher level than my educators but stumble hard on implementation i think most programs ive looked into teach the concepts well but infosec is a lot more commoditized than machine learning so if you dont plan to rise to the top youll have more demand and opportunity in infosec with a basic level of understanding everyone needs a secure database but few people need a simple neural network would you happen to have any recommendations for learning to program more as a subconscious reflex im very goal oriented so doing more exercises for the sake of exercises kills me inside python
671,its just a tragic accident at that point may as well make the parents responsible for not keeping track of their child
672,imagine the world in which tired and drunk drivers no longer kill other people on the roads were at the cusp of that though flip side i dont think weve considered how disruptive this will be to people who drive vehicles for a living
673,i used to have a hr commute for school i dream of the day when we can legally sleep in self driving cars i know that being awake should be mandatory to prevent accidents but a man can dream
674,whaaat my dad and i drove to san diego from la in his tesla and it kept telling him to push the steering wheel buttons every so often in autopilot eventually my dad just stopped paying attention and the car stopped autopilot until we reached our destination
675,the things that drives me nuts about all of these articles is that they blame tesla for what people are doing anyone using a defeat device for their ap hand detection is a scumbag and deserves a steep ticket anyone intentionally thinking they can grab a nap is a scumbag putting people in danger and deserves an arrest immediately assume that the person is doing whatever is happening intentionally there will probably be dozens of people that accidentally fall asleep while driving this week and crash hopefully solo but many will crash into other people there will probably be at least a handful of seizuresstrokesdiabetic shock whatevers this week that cause someone to crash those things are most likely not that persons fault gloss over the fact that not one of these instances being rabidly spread all over the internet ends with a collision much less injury people have so many reasons why they crash some of them may be happening in these videos but everyones knee jerk reaction is fuck that guy for intentionally sleeping he should die and tesla is to blame how about acknowledge that this technology might save you from death if you or one of your fellow motorists has a medical emergency while driving it safely got this guy down the road for allegedly minutes without incident id say thats pretty remarkable
676,the things that drives me nuts about all of these articles is that they blame tesla for what people are doing anyone using a defeat device for their ap hand detection is a scumbag and deserves a steep ticket anyone intentionally thinking they can grab a nap is a scumbag putting people in danger and deserves an arrest immediately assume that the person is doing whatever is happening intentionally there will probably be dozens of people that accidentally fall asleep while driving this week and crash hopefully solo but many will crash into other people there will probably be at least a handful of seizuresstrokesdiabetic shock whatevers this week that cause someone to crash those things are most likely not that persons fault gloss over the fact that not one of these instances being rabidly spread all over the internet ends with a collision much less injury people have so many reasons why they crash some of them may be happening in these videos but everyones knee jerk reaction is fuck that guy for intentionally sleeping he should die and tesla is to blame how about acknowledge that this technology might save you from death if you or one of your fellow motorists has a medical emergency while driving it safely got this guy down the road for allegedly minutes without incident id say thats pretty remarkable
677,the things that drives me nuts about all of these articles is that they blame tesla for what people are doing anyone using a defeat device for their ap hand detection is a scumbag and deserves a steep ticket anyone intentionally thinking they can grab a nap is a scumbag putting people in danger and deserves an arrest immediately assume that the person is doing whatever is happening intentionally there will probably be dozens of people that accidentally fall asleep while driving this week and crash hopefully solo but many will crash into other people there will probably be at least a handful of seizuresstrokesdiabetic shock whatevers this week that cause someone to crash those things are most likely not that persons fault gloss over the fact that not one of these instances being rabidly spread all over the internet ends with a collision much less injury people have so many reasons why they crash some of them may be happening in these videos but everyones knee jerk reaction is fuck that guy for intentionally sleeping he should die and tesla is to blame how about acknowledge that this technology might save you from death if you or one of your fellow motorists has a medical emergency while driving it safely got this guy down the road for allegedly minutes without incident id say thats pretty remarkable
678,until the vast majority of vehicles are changed to self driving models you will not be able to just sleep safely in your car its not even the automatic drivers its the human ones that will still be causing accidents and speeding and everything
679,maybe i heard this somewhere else but imagine self driving ubers and the like where the human driver died nobody wants to get in those cars so they just send it off to get another one most people arent compassionate enough to care so eventually we end up with all these mobile coffins driving around
680,rationally insurance rates should drastically drop after self driving automobiles prove to be faultless in auto accidents something tells me however big insurance will still be outrageously overpriced
681,i pray that when this guy finally crashes its into a guard rail by himself and not into another driver
682,i pray that when this guy finally crashes its into a guard rail by himself and not into another driver
683,if his little thing tied around that steering wheel fell off and he was still sleeping he would have slammed into somebody going miles per hour miladinovich said not true if autopilot detects that youre not gripping the wheel and you continuously ignore or arent awake to notice all of its warnings it will put your hazards on and gradually slow to a stop still not the safest situation on a freeway but its not like it just shuts autopilot off and lets you just drift until you crash ironically the thing falling off might have been the best thing that could happen since the warnings could have woken him up
684,eventually someone will die in one and the car will just keep driving around
685,drinking beers with buddies in the car and be like did you know we had to drive these things hahaha
686,heres the thing drivers have always fallen asleep at the wheel especially on long commutes the fact that a tesla driver gets caught sleep driving means a traditional car hasnt fallen asleep at the wheel wrecked and potentially killed someone
