,comment
1249,i would rather die to a self driving car than to a stupid human who drives drunk or simply reckless
1250,look im a believer in the tech eventually but the whole even our most underdeveloped models will be an improvement is speculative bullshit ive been driving since without a ticket or accident much of that through mn winters disclosure i did slip into someones bumper in a parking lot during an ice storm but was going very slow and no damage was done i have over years in my model and that clobbers the years in automated driving for sure computers will end up being better and wont be distracted or get tired still we have a long way to go to prove that the tech is consistently better than humans one needs to consider we also have a long history of hubris and over confidence in technology visa crashes all across europe this weekend leaving millions without a way to pay we found out last year that pretty much every single chip is vulnerable to attack im not against it and i get that we need to prepare people for failures but lets not over promise
1251,look im a believer in the tech eventually but the whole even our most underdeveloped models will be an improvement is speculative bullshit ive been driving since without a ticket or accident much of that through mn winters disclosure i did slip into someones bumper in a parking lot during an ice storm but was going very slow and no damage was done i have over years in my model and that clobbers the years in automated driving for sure computers will end up being better and wont be distracted or get tired still we have a long way to go to prove that the tech is consistently better than humans one needs to consider we also have a long history of hubris and over confidence in technology visa crashes all across europe this weekend leaving millions without a way to pay we found out last year that pretty much every single chip is vulnerable to attack im not against it and i get that we need to prepare people for failures but lets not over promise
1252,look im a believer in the tech eventually but the whole even our most underdeveloped models will be an improvement is speculative bullshit ive been driving since without a ticket or accident much of that through mn winters disclosure i did slip into someones bumper in a parking lot during an ice storm but was going very slow and no damage was done i have over years in my model and that clobbers the years in automated driving for sure computers will end up being better and wont be distracted or get tired still we have a long way to go to prove that the tech is consistently better than humans one needs to consider we also have a long history of hubris and over confidence in technology visa crashes all across europe this weekend leaving millions without a way to pay we found out last year that pretty much every single chip is vulnerable to attack im not against it and i get that we need to prepare people for failures but lets not over promise
1253,i dont want a self driving car if im going to die in a car accident at least i want to be responsible for my own death rather than some random computer glitch lol
1254,i dont want a self driving car if im going to die in a car accident at least i want to be responsible for my own death rather than some random computer glitch lol
1255,agree completely while we should do everything in our power to minimize and mitigate any dangers and death there invariably are going to be accidents just like the first horse drawn buggies just like the introduction of trains streetcars planes and yes automobiles any new world altering technologies in transportation will come at a cost in life
1256,as someone who has never killed anyone while driving fuck off with that
1257,that is unacceptable just an excuse with this logic might as well start selling unproven medicine in the market it will surely kill some people but over the long haul cures will be discovered
1258,a lot of people died in the creation of the offspry helicopter prob spelled wrong these people were willing to die for this if im driving down the high way and the self driving car kills me its different because i didnt sign up for this shit
1259,a lot of people died in the creation of the offspry helicopter prob spelled wrong these people were willing to die for this if im driving down the high way and the self driving car kills me its different because i didnt sign up for this shit
1260,imagine after the first car accident causing death people would have said we should have stayed with the horses
1261,smart cars will kill hundreds but will save thousands
1262,the humans that get killed by self driving cars are most likely to blame the technology is good but human error will always be a factor in road deaths weather driving or not
1263,id rather get killed by a self driving car because i know my death will cause an investigation on what went wrong and will lead to an improvement if i get killed by someone texting theres no guarantee their driving will improve or they will stop texting and driving
1264,people are going to die at first get over it is probably not the greatest stance to take if youre trying to promote widespread adoption in order to flatten the learning curve for the driving algorithms when theres a perfectly viable alternative available that people have been using for years most people will be happy to say no thanks let me know when youve worked all the kinks out and then ill think about it even if they are statistically more safe in an autonomous vehicle the technology needs strong adoption because truly safe autonomous driving is going to require millions upon millions of miles driven so that nearly every combination of scenarios can be encountered and appropriately mitigated through software learning then theres the whole casualty insurance elephant in the room that no one seems to want to address
1265,itt people being perfectly okay with robots killing humans
1266,problem if a human driver kills someone theyre liable personally through their insurance if an autonomous car kills someone the car maker will probably assume liability that shifts the incentives with the risks and corporations are far more risk averse than people
1267,theyll kill less people than my blind grandma will in the coming years shes good to drive for more years just because she passed the eye exam a year ago
1268,in other words these cars will kill some of you but lets just get over that because i think its totally going to be worth it for me if you lose your life the future is going to be cool
1269,half a million a year die on the road and nobodys bats an eye kill guy with a robot car and everyone loses there mind
1270,half a million a year die on the road and nobodys bats an eye kill guy with a robot car and everyone loses there mind
1271,the title article is really bad it makes it out to be that self driving cars will try to kill people
1272,i live in a place where hunting is pretty much not allowed and there arent very many predators left so the deer have overpopulated every single patch of undeveloped land around and they literally run right out in front of you especially in autumn i once had one run into the side of my car while i was at a stop sign and break my side mirror im not trying to get killed by a deer coming through my windshield how do self driving cars account for that
1273,so how is this going to work legally if youre texting or drunk behind the wheel and cause an accident you personally can get hauled into court if you hit a patch of ice through no fault of your own and slide into somebody your insurance in some places bites the bullet who pays the piper if your self driving car takes it into its little circuits to cross the median at mph and wipe out a family of in a minivan in the oncoming lane
1274,didnt all this start over that car and someone breaking there ankle or did someone die
1275,some of you may die but that is a sacrifice i am willing to make lord farquaad
1276,it is not rational for an excellent driver to cede control to an inferior machine it is reasonable enough i suppose for a bad driver to cede to a superior machine then again it is even more reasonable for a bad driver to pay attention and adopt safer driving practices so im not seeing us reasoning our way into self driving vehicles that kill us tl dr statistical improvements in survival rates do not necessarily translate to what make sense for individuals
1277,i agree but think a lot of laws need to be worked out soon who is responsible for any accident thats the ultimate question who pays for damages and do we convict the makers or the person who is behind the wheel what happens if it is a complete accident on all parts i remember reading some cars will put the safety of the occupants of the vehicle above all else as a luxury design to be sold almost like a safety feature that takes it as collateral damage cars like that should be highly illegal imo imagine if an automated car chooses to hit a person on the sidewalk because there is no other way to avoid a collision and save the occupants that in my mind is unacceptable morally right now human drivers are at the mercy of the human condition with the eventually increase of automation we can literally pre program ahead of time what we want to happen this is just one tiny facet of so many questions that will need to be answered
1278,how much were you paid to post this crap bad food will kill people but it is an improvement on the really really bad food
1279,in the same time period as those two accidents involving teslas i wonder how many accidents involving human driven cars occurred and how many of those were fatal id wager quite a lot
1280,well as long as self drivingassisting cars kill less people and make daily commute faster bring on the future but i still hope for teleportation
1281,stop these articles stop saying death equivalency is good enough thats not the issue at all this issue is that driving in a automated car was like being taken on a ride by a depressed chauffeur huffing glue sure most of the time he does great but every once and a while he does something completely irrational before passing out leading to easy fatalities we have to be able to relax ourselves these articles advocates blind trust it doesnt matter if my chauffeur thinks its okay to drive full speed into the side of a semi truck sometimes because hes still better than the average driver does the psychological mindset of the passengers matter at all this is not respect or trust its blind submission to a ridiculously flawed driver what if this chauffeur was x more likely to cause life crippling permanent injuries in every crash than the average driver what if every fatality it caused was a small child that he runs over at mph because those damn kids are too small to see yet he still only killed as many humans as the average driver nhtsa is right to advocate for x less fatalities before its ready i think were getting pretty close to trustworthy self driving cars and most people dont realize how damn easy it will be to achieve once we have the right software
1282,stop these articles stop saying death equivalency is good enough thats not the issue at all this issue is that driving in a automated car was like being taken on a ride by a depressed chauffeur huffing glue sure most of the time he does great but every once and a while he does something completely irrational before passing out leading to easy fatalities we have to be able to relax ourselves these articles advocates blind trust it doesnt matter if my chauffeur thinks its okay to drive full speed into the side of a semi truck sometimes because hes still better than the average driver does the psychological mindset of the passengers matter at all this is not respect or trust its blind submission to a ridiculously flawed driver what if this chauffeur was x more likely to cause life crippling permanent injuries in every crash than the average driver what if every fatality it caused was a small child that he runs over at mph because those damn kids are too small to see yet he still only killed as many humans as the average driver nhtsa is right to advocate for x less fatalities before its ready i think were getting pretty close to trustworthy self driving cars and most people dont realize how damn easy it will be to achieve once we have the right software
1283,is anyone actually advocating for self driving technology to be halted as a result of these accidents or is this article perhaps a self defense response to the media criticism teslaautomated vehicles have received in recent weeks there is nothing wrong with the media reporting on the failures of this new technology thats how improvements are made i have no idea why people jump straight to whataboutisms when anything even slightly critical of self driving cars is published well what about human drivers well what about them what does that have anything to do with self driving technology and the limitations that the industry currently has
1284,reddit pushes this ai shit so much im starting to wonder if its being run by ai you guys are literally trying to normalize robot cars killing people in mass before it starts happening wtf
1285,the biggest concern i have with this is whose life is prioritized in case of an imminent accident lets say a child runs out into the road after a ball or something self driving car rolls up and does not have enough time to stop and the only options are a hit the kid or b avoid the kid at the cost of hitting a tree either scenario it is likely someone will be seriously injured or killed how can a machine be programmed to make split second decisions to minimize fatalities and injuries the kid was really doing nothing wrong but should the passengers be killed for something out of their control
1286,the biggest concern i have with this is whose life is prioritized in case of an imminent accident lets say a child runs out into the road after a ball or something self driving car rolls up and does not have enough time to stop and the only options are a hit the kid or b avoid the kid at the cost of hitting a tree either scenario it is likely someone will be seriously injured or killed how can a machine be programmed to make split second decisions to minimize fatalities and injuries the kid was really doing nothing wrong but should the passengers be killed for something out of their control
1287,the problem nobody talks about is when the system gets hacked and it will and hundreds of people die
1288,apparently posts here need to be lengthy or be deleted so here goes self driving cars will kill people and we need to accept that that doesnt sound very reassuring it sounds like london lord mayor sadiq khans reassurances to the uk population in the face of all the acid attacks police sanctioned child raping gangs bombings and stabbings that he feels we must get used to the muslim threat because the threat of terror attacks are part and parcel of living in a big city will most likely be an improvement over a human drivers ability most likely that doesnt sound very reassuring anyway which human driver are they talking about
1289,yea but an automatic car driving into the back of a semi killing someone is a lot different than a drunk person crashing into a tree
1290,yea but an automatic car driving into the back of a semi killing someone is a lot different than a drunk person crashing into a tree
1291,i never understand this mentality self driving cars will never be accepted if you are asking people to accept that self driving cars can kill people its like asking people to get on a roller coaster ride but people may die on it randomly but people should accept that risk for roller coaster ride sure you might argue that human drivers have higher statistics of road accidents than self driving cars but youre ignoring that people think that in human driving those who drive properly and follow rules have significantly low risk of being in an accidents and its true too to some extent so theres an element of control here so human psychology has a tendency to think that if i drive properly ill be rewarded by safety pay attention follow the rules and my driving will keep me protected but thats not the case with self driving cars even if youre a good driver it does not have any outcome on how car drives thats like taking away control from the hands of humans its like playing russian roulette where its totally upto luck and not your driving whether youll be killed on this particular car ride or not so everytime you get in self driving car it may be your last ride and you can do nothing about it i think this will be a significant barrier in mass adoption of self driving cars unless they make their system perfect
1292,i never understand this mentality self driving cars will never be accepted if you are asking people to accept that self driving cars can kill people its like asking people to get on a roller coaster ride but people may die on it randomly but people should accept that risk for roller coaster ride sure you might argue that human drivers have higher statistics of road accidents than self driving cars but youre ignoring that people think that in human driving those who drive properly and follow rules have significantly low risk of being in an accidents and its true too to some extent so theres an element of control here so human psychology has a tendency to think that if i drive properly ill be rewarded by safety pay attention follow the rules and my driving will keep me protected but thats not the case with self driving cars even if youre a good driver it does not have any outcome on how car drives thats like taking away control from the hands of humans its like playing russian roulette where its totally upto luck and not your driving whether youll be killed on this particular car ride or not so everytime you get in self driving car it may be your last ride and you can do nothing about it i think this will be a significant barrier in mass adoption of self driving cars unless they make their system perfect
1293,i never understand this mentality self driving cars will never be accepted if you are asking people to accept that self driving cars can kill people its like asking people to get on a roller coaster ride but people may die on it randomly but people should accept that risk for roller coaster ride sure you might argue that human drivers have higher statistics of road accidents than self driving cars but youre ignoring that people think that in human driving those who drive properly and follow rules have significantly low risk of being in an accidents and its true too to some extent so theres an element of control here so human psychology has a tendency to think that if i drive properly ill be rewarded by safety pay attention follow the rules and my driving will keep me protected but thats not the case with self driving cars even if youre a good driver it does not have any outcome on how car drives thats like taking away control from the hands of humans its like playing russian roulette where its totally upto luck and not your driving whether youll be killed on this particular car ride or not so everytime you get in self driving car it may be your last ride and you can do nothing about it i think this will be a significant barrier in mass adoption of self driving cars unless they make their system perfect
1294,wonder how people will feel if the ai in their car makes the decision to sacrifice its passengers rather than pedestrians public eg if car loses its brakes has the choice between running off a cliff killing the passengers inside vs running into a crowd of people certainly killing many more would anyone be ok with getting into a car that may decide to kill its passengers given the right circumstances
1295,nah you shouldnt have to just accept loss of life if self driving cars will kill people they shouldnt be on the road youre an idiot at least with human drivers theres accountability no one is held accountable for self driving cars killing people yet we have the means to make them safe wannabe tech bros like you think lives dont matter to progress lol clown
1296,this idea that we should accept self driving cars killing people is questionable at least to me now self driving tech comes from private companies who owns the code eh so nobody knows whats in the code eh so therefore consider this scenario a government with less than free and democractic ideals cough china cough implements a self driving software that does not recognise certain people dissenters as humans but their death would look like a traffic accident right in fact it would be perfectly easy for a government to decide for some features ex a hijab or sunglasses or even black skin to be not human and thus eliminate undesirables in traffic accidents as long as corporations can hide behind the auto car kills less than manual car defence the life or death of every person walking down the street will be decided based on a hidden piece of code that may or may not discriminate against you oh software discrimination totally happened before i remember reading something a while back about the face unlock tech being less accurate on asians than europeans imagine this sort of thing happening with a car coming towards you
1297,this idea that we should accept self driving cars killing people is questionable at least to me now self driving tech comes from private companies who owns the code eh so nobody knows whats in the code eh so therefore consider this scenario a government with less than free and democractic ideals cough china cough implements a self driving software that does not recognise certain people dissenters as humans but their death would look like a traffic accident right in fact it would be perfectly easy for a government to decide for some features ex a hijab or sunglasses or even black skin to be not human and thus eliminate undesirables in traffic accidents as long as corporations can hide behind the auto car kills less than manual car defence the life or death of every person walking down the street will be decided based on a hidden piece of code that may or may not discriminate against you oh software discrimination totally happened before i remember reading something a while back about the face unlock tech being less accurate on asians than europeans imagine this sort of thing happening with a car coming towards you
1298,so when a self driving car is bound to crash into either a mom with a baby in a troller or a grandpa walking with his grandson how does it decide who to kill and who is responsible for that decision
1299,so when a self driving car is bound to crash into either a mom with a baby in a troller or a grandpa walking with his grandson how does it decide who to kill and who is responsible for that decision
1300,i hope that the author of this shit piece is among the first killed if these toys are ever allowed to freely drive public roads
1301,bs no autonomous vehicle will ever out drive a well trained and seasoned human driver if machines make mistake than they are underdeveloped a human makes mistakes yes a human also makes corrections and builds skill based on a need to survive machine gives no fucks unless it has to do with getting amped da
1302,people get killed by people driving cars all the time
1303,good luck getting people to accept it and saying people will die is making it less popular with the public to the point they will start demanding more laws and regulations and whatever for the cars people feel as if the public are being used as the beta testers and people saying some will die get over it it will be better later isnt helping
1304,yep in the time it takes you to read a story about an isolated incident with an autonomous car dozens of people have died in accidents with human drivers
1305,yep in the time it takes you to read a story about an isolated incident with an autonomous car dozens of people have died in accidents with human drivers
1306,still at early stage of development and we can expect accidents which cause by peopletheres alot of dumb ass people on the road and more dangerous than driverless car
1307,i wonder how driver accountability will mess with things like say we have car accidents in june as it is now the fault of them falls on the individuals who caused them but now say ford motors makes autonomous cars and there are only wrecks in june but now all wrecks are fords fault and ford loses a lot of money in lawsuits i wonder how much that would discourage this technology from moving forward just thoughts i dont really know it might not have an impact at all
1308,no self driving cars shouldnt kill anyone that should be the goal and anything less should be failure
1309,is there a projected number im willing to bet its far lower than accidents caused by drivers who are drunk and drivers that text on that topic of texting and driving i feel an appropriate punishment for causing an accident whilst doing so should be a permanent loss of license
1310,i think they should drop the speaker that shouts die human as it crashes into you they dont have that well they should at first just to get a conversation going
1311,i think they should drop the speaker that shouts die human as it crashes into you they dont have that well they should at first just to get a conversation going
1312,i think they should drop the speaker that shouts die human as it crashes into you they dont have that well they should at first just to get a conversation going
1313,finally its been put into words they cant be so afraid of accidents that they just never do anything ever
