,comment
1866,internally testing an ai update can catch major and common flaws like running a red light or failing to notice a pedestrian and i think this is where regulation will come in the ai must pass these common situation without fail before an update may be released but its the rare or edge case situations that have to be tested in the wild and thats where the lets see what happens comes in lets use a semi fake example and pretend the next release has a flaw a fsd tesla will crash if its heading east on the freeway traveling at mph at sunrise heading into the rising sun with an ambulance stopped in the right lane with its lights on the tesla crashes into the ambulance because the ai has never seen this situation before who is going to think of this extremely specific scenario and test to make sure it doesnt happen probably no one until it happens then tesla would go in and fix the error and the ai will never crash under these circumstances again the problem with testing an ai update is that no single person or company is going to be able to test all driving scenarios before releasing the update if we are to be honest and open about fsd ai then we must acknowledge that the only true way to test an ai is to release it publicly and see what happens all this being said i think its fair to ask and discuss the following questions is fsd ai worth the risk would regulations be useful what should regulations cover other stuff i cant think of
1867,internally testing an ai update can catch major and common flaws like running a red light or failing to notice a pedestrian and i think this is where regulation will come in the ai must pass these common situation without fail before an update may be released but its the rare or edge case situations that have to be tested in the wild and thats where the lets see what happens comes in lets use a semi fake example and pretend the next release has a flaw a fsd tesla will crash if its heading east on the freeway traveling at mph at sunrise heading into the rising sun with an ambulance stopped in the right lane with its lights on the tesla crashes into the ambulance because the ai has never seen this situation before who is going to think of this extremely specific scenario and test to make sure it doesnt happen probably no one until it happens then tesla would go in and fix the error and the ai will never crash under these circumstances again the problem with testing an ai update is that no single person or company is going to be able to test all driving scenarios before releasing the update if we are to be honest and open about fsd ai then we must acknowledge that the only true way to test an ai is to release it publicly and see what happens all this being said i think its fair to ask and discuss the following questions is fsd ai worth the risk would regulations be useful what should regulations cover other stuff i cant think of
1868,nothing says great engineering like having to take your car into the dealer for recalls because of a potential airbag failure or seatbelt failure or electrical issue which cuts your engine or endless list of recalled items thats real engineering right there cutting corners to sell products and avoiding consequences until the nhtsa tells you to fix the shit because its injuring or killing people thats why i only buy other companies products and you should too
1869,theyre not wrong the easiest way to progress quickly is to move fast and break things thats fine when you accidentally break peoples access for a few hours to large scale knowledge database that has only existed for the last years or so thats not fine when the things you are breaking are users bones bodies and lives tesla takes the attitude of software design sometimes all that said tesla actually does a lot of heavy testing and checks the problem of being at the edge is that theres edge cases that only happen of the time and its really hard to fix remember when toyotas modification of accelerators and mats resulted in a huge amount of accidents to pay million in crash settlement mats still to blame it took over years since the issue was identified and toyota would still deny the obvious teslas engineering is top notch and their cars have had less security issues and better fixes than their competitors throughout the years blame the culture and management but the engineering is top notch human and sometimes making mistakes but as good quality as any other car maker as a matter of fact that will be the problem that self driving cars will have there will be errors and failures that will result in deaths but even if self driving cars do only slightly better than the average youd have to go to tens of thousands of deaths before it wouldnt still be a better idea than not doing it but people dont see it like that its the airplane fallacy someone would rather go drive cross country out of fear of dying on an airplane crash when in reality the moment they have the highest chance of dying on a flight is on the drive to and back from the airport a cross country trip is incredibly dangerous in comparison but because seeing someone die being run over or due to a car crash is an every day occurrence no one really talks about and we dont think but airplane crashes are so rare we obsess over them the safer car gets the more national news a car crash will be in this specific case though musk shot himself on the foot imho had he been less combative this wouldnt have escalated into an issue that is national news the tech is not at a point thats ready to ask for regulation revisits and offering more freedom on it while it may be mature enough that this would be beneficial we really dont have enough data even if tesla is doing it right its not easy to imagine what regulations must be set someone else could come with their cheap version that screws everyone and sets back the regulatory evolution of self driving cars a decade there is such a thing as too soon
1870,theyre not wrong the easiest way to progress quickly is to move fast and break things thats fine when you accidentally break peoples access for a few hours to large scale knowledge database that has only existed for the last years or so thats not fine when the things you are breaking are users bones bodies and lives tesla takes the attitude of software design sometimes all that said tesla actually does a lot of heavy testing and checks the problem of being at the edge is that theres edge cases that only happen of the time and its really hard to fix remember when toyotas modification of accelerators and mats resulted in a huge amount of accidents to pay million in crash settlement mats still to blame it took over years since the issue was identified and toyota would still deny the obvious teslas engineering is top notch and their cars have had less security issues and better fixes than their competitors throughout the years blame the culture and management but the engineering is top notch human and sometimes making mistakes but as good quality as any other car maker as a matter of fact that will be the problem that self driving cars will have there will be errors and failures that will result in deaths but even if self driving cars do only slightly better than the average youd have to go to tens of thousands of deaths before it wouldnt still be a better idea than not doing it but people dont see it like that its the airplane fallacy someone would rather go drive cross country out of fear of dying on an airplane crash when in reality the moment they have the highest chance of dying on a flight is on the drive to and back from the airport a cross country trip is incredibly dangerous in comparison but because seeing someone die being run over or due to a car crash is an every day occurrence no one really talks about and we dont think but airplane crashes are so rare we obsess over them the safer car gets the more national news a car crash will be in this specific case though musk shot himself on the foot imho had he been less combative this wouldnt have escalated into an issue that is national news the tech is not at a point thats ready to ask for regulation revisits and offering more freedom on it while it may be mature enough that this would be beneficial we really dont have enough data even if tesla is doing it right its not easy to imagine what regulations must be set someone else could come with their cheap version that screws everyone and sets back the regulatory evolution of self driving cars a decade there is such a thing as too soon
1871,theyre not wrong the easiest way to progress quickly is to move fast and break things thats fine when you accidentally break peoples access for a few hours to large scale knowledge database that has only existed for the last years or so thats not fine when the things you are breaking are users bones bodies and lives tesla takes the attitude of software design sometimes all that said tesla actually does a lot of heavy testing and checks the problem of being at the edge is that theres edge cases that only happen of the time and its really hard to fix remember when toyotas modification of accelerators and mats resulted in a huge amount of accidents to pay million in crash settlement mats still to blame it took over years since the issue was identified and toyota would still deny the obvious teslas engineering is top notch and their cars have had less security issues and better fixes than their competitors throughout the years blame the culture and management but the engineering is top notch human and sometimes making mistakes but as good quality as any other car maker as a matter of fact that will be the problem that self driving cars will have there will be errors and failures that will result in deaths but even if self driving cars do only slightly better than the average youd have to go to tens of thousands of deaths before it wouldnt still be a better idea than not doing it but people dont see it like that its the airplane fallacy someone would rather go drive cross country out of fear of dying on an airplane crash when in reality the moment they have the highest chance of dying on a flight is on the drive to and back from the airport a cross country trip is incredibly dangerous in comparison but because seeing someone die being run over or due to a car crash is an every day occurrence no one really talks about and we dont think but airplane crashes are so rare we obsess over them the safer car gets the more national news a car crash will be in this specific case though musk shot himself on the foot imho had he been less combative this wouldnt have escalated into an issue that is national news the tech is not at a point thats ready to ask for regulation revisits and offering more freedom on it while it may be mature enough that this would be beneficial we really dont have enough data even if tesla is doing it right its not easy to imagine what regulations must be set someone else could come with their cheap version that screws everyone and sets back the regulatory evolution of self driving cars a decade there is such a thing as too soon
1872,theyre not wrong the easiest way to progress quickly is to move fast and break things thats fine when you accidentally break peoples access for a few hours to large scale knowledge database that has only existed for the last years or so thats not fine when the things you are breaking are users bones bodies and lives tesla takes the attitude of software design sometimes all that said tesla actually does a lot of heavy testing and checks the problem of being at the edge is that theres edge cases that only happen of the time and its really hard to fix remember when toyotas modification of accelerators and mats resulted in a huge amount of accidents to pay million in crash settlement mats still to blame it took over years since the issue was identified and toyota would still deny the obvious teslas engineering is top notch and their cars have had less security issues and better fixes than their competitors throughout the years blame the culture and management but the engineering is top notch human and sometimes making mistakes but as good quality as any other car maker as a matter of fact that will be the problem that self driving cars will have there will be errors and failures that will result in deaths but even if self driving cars do only slightly better than the average youd have to go to tens of thousands of deaths before it wouldnt still be a better idea than not doing it but people dont see it like that its the airplane fallacy someone would rather go drive cross country out of fear of dying on an airplane crash when in reality the moment they have the highest chance of dying on a flight is on the drive to and back from the airport a cross country trip is incredibly dangerous in comparison but because seeing someone die being run over or due to a car crash is an every day occurrence no one really talks about and we dont think but airplane crashes are so rare we obsess over them the safer car gets the more national news a car crash will be in this specific case though musk shot himself on the foot imho had he been less combative this wouldnt have escalated into an issue that is national news the tech is not at a point thats ready to ask for regulation revisits and offering more freedom on it while it may be mature enough that this would be beneficial we really dont have enough data even if tesla is doing it right its not easy to imagine what regulations must be set someone else could come with their cheap version that screws everyone and sets back the regulatory evolution of self driving cars a decade there is such a thing as too soon
1873,im more worried about the bystanders and other motorists who didnt pay to get crashed into by a misbehaving self driving algorithm public road is not the place for beta testing that is what testing grounds and tracks are for
1874,if pedestrian accidents with fsd become a common problem theyll probably pull it or regulators will get involved so far there hasnt been any pedestrian accidents so i dont see what youre complaining about i actually have fsd beta and while it needs a lot of work in some aspects of driving it actually recognizes and avoids pedestrians really well
1875,apples to apples this would be like boeing installing some software they tested in simulated hardware into beta planes out of airplanes in service and then when they noticed the beta planes were braking erroneously during pre flight checks and they were getting altitude warnings while still on the ground they rolled the software on the beta planes back to the previous version this is what caused the rollback to occur on the beta tesla vehicles false collision warnings and unnecessary auto emergency braking events might occur translated out if a beta car had someone tailgating at speed and there was a false collision warning then there might be an emergency braking event and that might lead to an accident due to the human driver following closer than is safe not quite the headline news event is it
1876,im not aware of any crash happening as a result of that update its more like if boeing finds a safety issue in a line of parts they made for s and recalls those parts
1877,it becomes a public beta when you become one of the testing obstacles on the road no one outside of the car can knowingly consent to participate in this beta because it isnt a beta its pre production testing on an incomplete product that can potentially kill someone
1878,according to no one but tesla themselves of the m miles between accidents in manual mode would be on freeway and m off of it for the m miles in autopilot m would be on freeway and just off of it so the manual record is roughly one accident per m miles off freeway and per m miles on freeway but the autopilot record ballparks to m miles between accidents off freeway and m on freeway in other words about longer without an accident in manual with forward collision avoidance on or tacc than in autopilot instead of being safer with autopilot it looks like a tesla is slightly less safe
1879,the step in issue has been studied in other industries for decades including aviation but nice cheap redditism there when you cant actually contribute something of content
1880,do other car manufacturers have their software tested by regulators what exactly did you see coming was there a crash
1881,youre going to claim youve not heard of a single auto pilot or fsd death lol pretty wild not to mention teslas own data shows more accidents with auto pilot than not
1882,cars dont just kill people bad drivers do now put those bad drivers in cars that actually do kill people
1883,i am under no impression that fsd is perfect or even good but the bar is pretty low for exceeding human capability lets do some quick math the fatality rate for human drivers is deaths per million miles traveled statisticsdetailstate by state tesla has about million cars with autopilot on the road cleantechnicacomover tesla vehicles with autopilot on the road the average driver drives miles per week cut our driving in half is it time for pay per mile insurance shbadaad so telsa drivers alone are collectively averaging million miles per week this means that even if the tesla autopilot got into a fatal accident once a week every single week that fatality rate would be more than twice as safe as human drivers i think you severely overestimate what it takes to be better than the average driver and just perceive a higher risk because its a loss of control not cause its actually riskier
1884,use car crashes to control population sizes so you have less people on the road and the cars have an easier time navigating with less obstacles
1885,use car crashes to control population sizes so you have less people on the road and the cars have an easier time navigating with less obstacles
1886,are tesla cars less safe though the only statistics ive seen show that they are times safer than average electrekcotesla autopilot engaged x lower chance accident than average car data when you count how many accidents per aggregate million miles driven does anyone have statistics that show otherwise
1887,its likely going to cost lives before we know it its likely already has cost lives its just nearly impossible for the public to know if fsd was engaged or not at the time of an accident
1888,im not aware of any crash happening as a result of that update and how much of the reason there was no crash was only due to the reactions of those around the vehicle at the time
1889,where are you getting those numbers because they dont match up with any source from the nhtsa cdannhtsagovtsftablesnationalstatisticspdf in there were accidents out of miles driven miles per accident from teslas most recent quarterly safety report they recorded m miles between accidents without autopilot enabled and m miles between accidents with autopilot enabled m k x more miles between accidents or put another way autopilot is safer than driving manually
1890,your math isnt making any sense youre saying ap goes over million miles without an accident then saying it goes million without an accident according to your math how does that make sense
1891,i can see your point but currently autopilot or fsd with human supervision still outperforms manual driving accident wise so there arent really any more broken eggs compared to how many eggs are already being broken also its not like an accident has to happen in order for fsd to improve
1892,most people who die in car accidents are either breaking laws or the victims of people who have broken laws i dont think its an acceptable standard to decide that as long as robots do about as well as or somewhat better than humans at driving that everything is cool since that also includes all the humans who have died because they were doing something that we have made illegal like speeding distracted driving drunk driving etc the benchmark we use should not be how well does autonomous driving do against the sum total of all humans it should be how well does autonomous driving do against all the humans killed in accidents where they were not speeding not drunk not texting and not sleepy and actually a robot has killed a person yeah it was stupid and yeah youll think its bullshit but there really was a person who was run over by a car when they were walking with their bike at night there have been more cases of people killed by ignoring instructions to keep their hands on a wheel and then self driving cars would fail to see semis in front of them its only zero ever if you decide to ignore fatalities that have happened with people who ignored instructions to keep their hands on the wheel but theres a difference between the duty of an engineering team to design something that is hard to misuse and the realities of people who get distracted teslas team of engineers could have made it impossible to use self driving in unsafe ways if they wanted to but instead a person fell asleep with autopilot on and got decapitated by a semi thats an annoying inconvenience to address but its still there
1893,most people who die in car accidents are either breaking laws or the victims of people who have broken laws i dont think its an acceptable standard to decide that as long as robots do about as well as or somewhat better than humans at driving that everything is cool since that also includes all the humans who have died because they were doing something that we have made illegal like speeding distracted driving drunk driving etc the benchmark we use should not be how well does autonomous driving do against the sum total of all humans it should be how well does autonomous driving do against all the humans killed in accidents where they were not speeding not drunk not texting and not sleepy and actually a robot has killed a person yeah it was stupid and yeah youll think its bullshit but there really was a person who was run over by a car when they were walking with their bike at night there have been more cases of people killed by ignoring instructions to keep their hands on a wheel and then self driving cars would fail to see semis in front of them its only zero ever if you decide to ignore fatalities that have happened with people who ignored instructions to keep their hands on the wheel but theres a difference between the duty of an engineering team to design something that is hard to misuse and the realities of people who get distracted teslas team of engineers could have made it impossible to use self driving in unsafe ways if they wanted to but instead a person fell asleep with autopilot on and got decapitated by a semi thats an annoying inconvenience to address but its still there
1894,most people who die in car accidents are either breaking laws or the victims of people who have broken laws i dont think its an acceptable standard to decide that as long as robots do about as well as or somewhat better than humans at driving that everything is cool since that also includes all the humans who have died because they were doing something that we have made illegal like speeding distracted driving drunk driving etc the benchmark we use should not be how well does autonomous driving do against the sum total of all humans it should be how well does autonomous driving do against all the humans killed in accidents where they were not speeding not drunk not texting and not sleepy and actually a robot has killed a person yeah it was stupid and yeah youll think its bullshit but there really was a person who was run over by a car when they were walking with their bike at night there have been more cases of people killed by ignoring instructions to keep their hands on a wheel and then self driving cars would fail to see semis in front of them its only zero ever if you decide to ignore fatalities that have happened with people who ignored instructions to keep their hands on the wheel but theres a difference between the duty of an engineering team to design something that is hard to misuse and the realities of people who get distracted teslas team of engineers could have made it impossible to use self driving in unsafe ways if they wanted to but instead a person fell asleep with autopilot on and got decapitated by a semi thats an annoying inconvenience to address but its still there
1895,i dont agree that haywire or calamity as another on this thread called it is remotely appropriate if you imagine a perfect drive buggy software seems imperfect but humans dont have perfect drives die every year in the us alone add to that the number of injured and the billions in financial damages and you have the true real world baseline for current driving so does a beta software released to s of specifically safe drivers all of whom have been told that the software will likely make bad choices at the worst time qualify as going haywire when it randomly hits the brakes hell no the user can take control instantly the user is supposed to be paying attention they are holding the wheel they are warned in advance the user is selected from a small group of humans specifically based on their ability to consistently drive safe predictably and smooth the situation is far less dangerous than a squirrel running across the road in front of a regular driver is a squirrel crossing the road in front of a car indicative of a super dangerous situation would you have told your friends your drive went haywire on the way home if that happened of course not you probably wouldnt have told anyone because its not newsworthy just like this whole post
1896,who died and yes that would still be a private beta because thats how the terminology works if i have a private beta on my phone and walk outside it doesnt suddenly become a public beta if it was a public beta then all tesla owners would have it and that would be significantly worse
