,comment
0,or bring back trains and trams its the american illusion of a car autonomy that kills us cities
1,i think its control the ultimate planned obsolescence product an electric self driving car a simple software glitch or update and the battery life falls off want to fix it it only costs the cost of a new car just buy a new car uncle sam loves it because he can finally tell you when you travel and when you dont uh oh you took part in a unapproved anti government protest freedom credits your car no longer functions i have yet to see a single smart bit of technology that actually worked for the person its always control consumption is control technology is not being used to free us its going to enslave us its always a product a service something you dont control on a related note somewhat the more i read into the quality of renewable fuels like ethanol and biodiesel the more oil seems like the biggest scam i have ever seen rockefeller backed temperance movements with millions to wipe out the ethanol industry his biggest competition the modern car is a money sink and it doesnt need to be designed to fall apart and get you to buy another i just want a simple repairable motor vehicle that i can run on homemade ethanol something i can fix it doesnt even need to be fast if i could i would go mph tops
2,its a catch transit actually sucks so you have to have a car to get around but everyone having a car to get around means everything sprawls out and makes transit incredibly inefficient and expensive per passenger mile if planners were smart they would use fees and subsidies as levers to push sdcs to feed people into transit lines fewer transit lines with higher frequency means better performance
3,i think its going to be the normal after a decade its simply too lucrative to not happen quite literally gas stations have put ads on a gas pump because why not captive audience this is an even more captive audience and better yet one thats dependent on their device to get them where theyre going
4,marketing major and professional here i know i know op raises a good point about how theres a lot of psychology behind marketing thats a class in and of itself which is fascinating but definitely beyond the scope of intro however consumer behavior studies have found significant differences in how women shop vs men it is an important distinction to make there are a lot of studies to back up that distinction and its not necessarily sexist there are plenty of exceptions to the rule but when you have a marketing budget youre not going to target exceptions we want to group people together by purchasing habits and if there is a woman whos shopping in hm say shes likely buying into cyclical fashion not buying the cheaply made cheaply priced pieces for life as a general rule of thumb knowing who makes up the majority of your clientele is absolutely vital so you can target them in an integrated marketing campaign there is absolutely a lot of difference in how women perceive things how they interpret information which kinds of advertisements are more effective to them etc theres a classic article that all marketing students have read regarding this http knowledgewhartonupenneduarticlemen buy women shop the sexes have different priorities when walking down the aisles it might be how he says it but remember a lot of marketing professors are sleazy but there is nothing inheritantly sexist and bigoted in the source material
5,the following is a copy of the original post to record the post as it was originally written imagine a world where autonomous vehicles self driving cars become commonplace and overwhelmingly prove to be vastly superior to non autonomous vehicles regular cars a world where car accidents and car deaths are unheard of a world where pedestrians being hit by self driving cars is unheard of lets say we achieve this future where self driving cars are a significant portion of the cars out there and nobody on the planet can deny their efficacy and vast superiority over human drivers would you support banning non autonomous vehicles or would there be an element of individual freedom that outweighs the lives lost i am a bot and this action was performed automatically please contact the moderators of this subredditmessagecompose toraskaliberal if you have any questions or concerns
6,i think once autonomous cars are the norm the majority of accidents will be caused by people being demonstrably bad drivers doing the wrong thing on the road so the automated car couldnt react safely and once that happens i think thered be a strong public safety argument to do such a ban im honestly not sure if id support it but i can see that the argument would reasonably exist
7,no i would never support a ban of non autonomous vehicles there will always be people who are not comfortable with the technology plus it is extremely unlikely the technology will be accident proof in our lifetimes or even before or possibly after the technology would have to be absolutely accident and failure free before anyone jumps in with of course it will be safe by xxxx year you need to go back and look at the things predicted to be commonplace now that arent here yet or even coming along anytime soon
8,what happens if they gain sentience and decide to kill their driver even if that wasnt possible i still wouldnt be comfortable not controlling the vehicle
9,this is a delicate question it depends on a lot of factors there would be vast differences in attitudes between urban suburban and rural drivers their access to public transport would be vastly different as well and their access to features such as wireless charging accident avoidance infrastructure communication vehicle to vehicle for example would all be different based on whats available also there is a major set of people who enjoy driving this could continue via private roads though which would mostly be a large improvement in liability and safety driving could be a dedicated hobby which may prove out to be excellent compared to today
10,sure given a few prerequisites human induced accidents would have to be a major danger still and self driving vehicles or car alternatives would have to be as accessible as cars are for a transition period it may be good to have a grandfather clause so people who cant afford a new vehicle can keep their old one
11,i think the onus is the expectation that non autonomous vehicles will always function and perform perfectly technology is prone to glitches and failure rates do i think that non autonomous vehicles that never crash or cause injury are ideal of course but we dont live in a utopian society and i dont believe this technology will exist in our lifetime
12,i used to think this way but have since changed my mind this video is worth watching for some reasons why voafmniu but a good summary would be public transportation is the actual solution to the problems of traffic and accidents that said your question is if they were the perfect solution should driving your own car be banned and to that i say no i would support the creation of self driving lanes being added to highways however there is are cost sustainability and flexibility issues associated with autonomous vehicles that prevent them from being the only option in my mind i would also suggest that the solution is reducing the number of cars in our cities period regardless of whether they are autonomous or not i would really recommend checking out the video though its a good watch
13,not accident free just significantly and undeniably better than regular cars would comfort outweigh lives saved
14,if you want to drive a car with head level spikes instead of a bumper should that be allowed whats my life worth if you kill me
15,but what happens once ai is better at determining that than humans when humans taking over from the ai causes more accidents than it prevents
16,they should also be subject to criminal strict liability in the event that they injure or kill someone
17,if self driving cars do become the norm which i do not think will happen in our life time human operated vehicles will eventually have to die out because the human makes an exponential amount of errors relative to a self driving car the reason i do not think it will happen soon is because for there to be any sense of autonomous driving on the current system of roads there needs to be a minimum uniform code in the algorithm such that cars of different makes can communicate with each other say for example two cars traveling in opposite directions meet across from each other in an intersection and both want to turn east when humans operate vehicles this is easy because its just plain human interaction on the other hand if these cars are self driving both cars need to know when where and at what speed the other car is going to make the east turn why because if they dont they will go at the same time and hit each other trying to make the east turn at the same time this is a fundamental problem transitioning to an autonomous transportation system and i dont think private car manufacturers will be open to sharing their autonomous driving code with each other so in short i dont think you have to worry about existing in a world where you will be forced to adopt an autonomous driving vehicle
18,i mean it would technically be in the publics best interest to stay home all day and never interact with strangers thats a very different riskbenefit calculation than the one that is the the topic of this article american were killed by cars in in my estimation whatever jollies people get from being behind the wheel arent worth a single one of those lives
19,i dont think it would be acceptable to ban one form of transport for safety reasons for another that was not safe in addition if its between someone being able to get around or not because they dont trust the technology then they should be able to drive themselves comfort has always outweighed lives saved approximately million people are killed in fatal crashes each year on average thats about deaths a day globally an additional million are injured or accident statistics no one has banned cars yet
20,i dont think it would be acceptable to ban one form of transport for safety reasons for another that was not safe in addition if its between someone being able to get around or not because they dont trust the technology then they should be able to drive themselves comfort has always outweighed lives saved approximately million people are killed in fatal crashes each year on average thats about deaths a day globally an additional million are injured or accident statistics no one has banned cars yet
21,i dont think it would be acceptable to ban one form of transport for safety reasons for another that was not safe in addition if its between someone being able to get around or not because they dont trust the technology then they should be able to drive themselves comfort has always outweighed lives saved approximately million people are killed in fatal crashes each year on average thats about deaths a day globally an additional million are injured or accident statistics no one has banned cars yet
22,i dont think it would be acceptable to ban one form of transport for safety reasons for another that was not safe in addition if its between someone being able to get around or not because they dont trust the technology then they should be able to drive themselves comfort has always outweighed lives saved approximately million people are killed in fatal crashes each year on average thats about deaths a day globally an additional million are injured or accident statistics no one has banned cars yet
23,for my part i think cartraffic laws have gotten out of hand in some places just conceding that there arent a whole lot of meaningful hills left to die on
24,its far from complete the key point here is if human input shall always override the computer input then banning non autonomous car will become meaning less and you wont want computer control surpasses manual control eg max crash
25,in addition if its between someone being able to get around or not because they dont trust the technology then they should be able to drive themselves what if i dont trust you to drive yourself can i be able to have the technology drive you instead comfort has always outweighed lives saved approximately million people are killed in fatal crashes each year on average thats about deaths a day globally an additional million are injured or disabled no one has banned cars yet yeah thats objectively bonkers excuse me for not wanting to sacrifice myself so you can operate your cool toy
26,in addition if its between someone being able to get around or not because they dont trust the technology then they should be able to drive themselves what if i dont trust you to drive yourself can i be able to have the technology drive you instead comfort has always outweighed lives saved approximately million people are killed in fatal crashes each year on average thats about deaths a day globally an additional million are injured or disabled no one has banned cars yet yeah thats objectively bonkers excuse me for not wanting to sacrifice myself so you can operate your cool toy
27,in addition if its between someone being able to get around or not because they dont trust the technology then they should be able to drive themselves what if i dont trust you to drive yourself can i be able to have the technology drive you instead comfort has always outweighed lives saved approximately million people are killed in fatal crashes each year on average thats about deaths a day globally an additional million are injured or disabled no one has banned cars yet yeah thats objectively bonkers excuse me for not wanting to sacrifice myself so you can operate your cool toy
28,my point is we have govt regulations that specify how high a bumper should be so that suvs dont just crush smaller cars in accidents and thats a really good thing if we have a path to reduce road deaths even further we should take it my right to not die is more important than your right to drive recreationally on major highways or city streets
29,my point is we have govt regulations that specify how high a bumper should be so that suvs dont just crush smaller cars in accidents and thats a really good thing if we have a path to reduce road deaths even further we should take it my right to not die is more important than your right to drive recreationally on major highways or city streets
30,no retesting very few actual skills taught poor driving habits are not corrected or even addressed driving is more of a right than a privilege so someone will pass unless they arejust so bad they cant keep it together for a half assed job fit like minutes other than that its just a quick multiple choice exam that is a deep as a puddle
31,i think youd be surprised to hear about autopilot we had a plane crash just last week in san diego county because the inexperienced pilot turned off the autopilot on a lear jet
32,i think youd be surprised to hear about autopilot we had a plane crash just last week in san diego county because the inexperienced pilot turned off the autopilot on a lear jet
33,i cant say i disagree i dont think cars are very safe when they were first being popularized the opponents called them molochian devices for good reason accidents srop being accidental when we just accept them as a part of daily life
34,well food eating is fundamentally just a way for our bodies to intake nutrients and carbohydrates for energy bad food is essentially just base pleasure that creates a lot of risks but you are claiming that because driving creates dangerous externalities that this is fundamentally a different issue but plenty of freedoms come with risky externalities i mean accidents are like number in terms of causes of death which includes unintentional drowning should we ban swimming pools and beach access since theres no purpose aside from enjoyment that these things are allowed to be used
35,well food eating is fundamentally just a way for our bodies to intake nutrients and carbohydrates for energy bad food is essentially just base pleasure that creates a lot of risks but you are claiming that because driving creates dangerous externalities that this is fundamentally a different issue but plenty of freedoms come with risky externalities i mean accidents are like number in terms of causes of death which includes unintentional drowning should we ban swimming pools and beach access since theres no purpose aside from enjoyment that these things are allowed to be used
36,americans were killed by cars in hows that for a start
37,im prepared to accept that for the freedom to drive my own car people died every year from drowning but i dont hear anyone saying we should ban swimming
38,also yes people have accidentally fallen into pools and off promenades and drowned leaving these dangerous things open to the public is a risk
39,im prepared to accept that for the freedom to drive my own car its so nice of you to volunteer others to sacrifice themselves for your enjoyment unfortunately ill pass because whatever joy you and every other driver on earth get from being behind the wheel all of it together it doesnt add up to even one of those lives people died every year from drowning but i dont hear anyone saying we should ban swimming can you endanger others by swimming or only yourself because cars dont only endanger their drivers they also endanger others who never offered not be part of your hobby
40,yet americans were killed by cars in if the technology gets to the point where it allows us to take a huge chunk out of that number perhaps virtually all of it we should do it and if you lived where i do youd wonder about those drunk year olds
41,if an autonomous car hits and kills someone who is liable the driver or the car manufacturer
42,i dont think the replies are in favor of driving but more the freedom to have the option i personally would never drive again if this was a real option i hate driving but not as much as i hate police states and governmental over reach throwing axes in the middle of the street is just not an honest comparison ive driven my entire life and never killed a single person most people have in fact but if i started throwing axes in public id probably injure or kill someone in less than a week good drivers who honestly enjoy driving or perhaps just dont trust automation shouldnt be punished for other peoples mistakes just like we dont ban driving on holidays because its the time when the most drunk drivers are out we punish the individuals responsible not the entire society
43,those types of techniques can certainly reduce the incidence of false positives but in situations with enough vehicles and specular reflective surfaces your system can easily have very low confidence i used to work with vector templating system that can auto align using lasers and retro reflective material and even with all the tricks we lock out the ability to align two heads at the same time that are too close together these types of visual systems are very sensitive to interference i mean i worked on systems that needed thou accuracy on stationery mounts but i can certainly see a half dozen lidar scanners in very close proximity causing enough interference to atleast lower the confidence enough to make them significantly less reliable not to mention due to the fact that if a company wanted to use visible light lasers for improved range eyesafe and r systems are still incredibly distance limited for dynamically mounted sensors generally use at least other machine vision technology is needed to have adequate active track most of the vehicles that i have seen equipped with lidar systems are also using or other additional methods like machine vision with cameras and actual radar there is a reason we dont see automotive lidar on vehicles outside of experimental self driving applications and close to the ground warehouse autos controlled by a single server or coordinated through a hivemind iot architecture that is also supported by a server teslas decision to forgo lidar altogether didnt happen by accident its far easier to coordinate disparate devices when the scanners you are using arent emitters
44,most self driving cars use a combination of lidar and cameras so interference is not much of a problem some existing cars use radar for range finding on their automatic cruise control and automatic crash avoidance there is some potential for interference there if you had two cars of the same model that were almost side by side for example im not sure what if any mechanism they use to avoid that
45,great answer how badly do differences in material create interferances in the signal echo just as an example what if i were driving behind a truck that had a large foam box hanging out of its trunk could the sensor accidentally interpret the distance to the truck was double my actual distance
46,if this is the case couldnt a scrambler of some sort be very cheaply made to make untraceable interference that cycles frequencies like an accident machine just set it up in your trunk and wait for someone to rear end you
47,lnmagic sounds right but why is the bandwidth limited in the first place for radar the answer is the fcc and the equivalent regulatory bodies in other countries for example theres a mhz range of frequencies centered near mhz called the industrialscientificmedical ism band where youre allowed to transmit a lot of radar power if you expand out of that mhz bandwidth your allowed transmit power drops precipitously
48,i dont know how they work but the military has missiles that can home in on jamming signals where the jamming signal is able to confuse their radar they just go for the jamming signal instead this implies deliberate interference is both detectable and locatable somehow also im sure the car is logging or recording all the signals from its sensors in a crash whoever is investigating will download the logs from the car and will see the radar suddenly go weird its entirely possible that this might be regarded as suspicious depending on how the radar works
49,yes if the cars are sharing data then cars could react to things they cant yet sense going around a corner a lead car or a car coming from another direction could detect an animal in the road and tell the cars behind it to slow down maybe there are changing road conditions like a puddle mudslide ice etc this would not only make other self driving cars safer but it would potentially give human drivers more time to react leading to fewer secondary accidents pileups also as of last year googles car used lidar for small details which has problems in the rain snow so a car might not be able to accurately sense the road conditions until the traction control system tells the car about it which doesnt happen until the tires actually drive over the surface synced cars would make them all safer by giving them more data to base their decisions on
50,i think youre correct it probably isnt worth it to completely eliminate the chance since its so small but its interesting to think about how a solution would be implemented how much would it cost compared to the actual system and it would be worth it at all then again there could be ways to use that technology the one im proposing not the one they currently use maliciously probably have a device that tells the car im using all these frequencies except this one then the car is forced to use that single frequency then the malicious car could jam that frequency and blind the victim potentially causing an accident if no other security measures are in place for such an eventuality
51,good points i work for honda we use millimeter radar for our adaptive cruise control combined with the forward looking camera driving in heavy wet snow the system shut down on me accord hybrid touring with just a small amount of snow covering the radar sensor also if that accord got into a small accident and the radar sensor has to be replaced thatll be about just for the part
52,the exact same attack can be done on a human driver with nothing but a high powered flashlight at the end of the day you cant make anything perfectly safe against an attacker with unlimited time and funds to develop an attack thats the lesson weve learned from millenia of war offense will always win given enough time and money as silly as it seems if you want to kill someone badly enough you could get a nuke on the black market and simply vaporize their autonomous car
53,im a tech at the service center in marysville yes the car will keep itself in the lane on a straight road if you dont have your hands on the wheel for more than sec it will beep at you if you continue to keep your hands off the wheel it will suspend the lane keep assist the acc system will bring the car down to mph with the brakes but will then cancel below that speedacura has low speed follow the collision mitigation braking system will help lower the severity of a crash but it wont prevent it if the cmb system has to step in youre going to hit something
54,note that cars have both camera and radar but it is scary to think that a driverless car will allow someone totally asleep to be driving along unable to react if the machine is compromised no different from a rear seat passengfer in a car if the driver has a fit at speed what can said passenger do or a passenger in an aircraft those things dont actually need pilots anymore but the lawyers wont let us get rid of them so we still have manual air traffic control and everytime one crashes its human error theyd be safer uncrewed
