,comment
189,worked in insurance for years made it to lower senior management in two global corporations and have a diploma in insurance really im a totally interesting and swell guy who absolutely didnt own several different shades of grey suit honest im going to say on this one that i disagree an insurance company is in the business of lowering risk exposure against premium charged in order to increase their profit margin essentially the less they have to pay out the better sometimes they do this with good advice to the customer based on their knowledge of what likely causes of loss are particularly type of door lock or burglar alarm works better they will advise you fit it and can lower your premium accordingly they know with those youre less likely to have a loss and they get to keep more premium across the pool of risks they insure every year anyway currently to insure a car they have to assess individual drivers ability lifestyle carelessness decision making skills location commute type of parking level of car usage type of use and experience some they can ask you some they can use big data to figure the trends but in a lot of cases they simply cant know as much about you as you know about you so their premium charged has to guess and factor that in i worked on multiple books of motor insurance that had a combined operating ratio money in verses money out of over you need less than to be making money and these were the big insurance companies with the really good systems low operating costs internal efficiencies and damn good actuaries in the uk the motor industry lost money every year for over a decade i dont know the stats these daystheyd make up for it in other areas for an insurance company where in the uk it is compulsory for a driver to have at least third party liability to cover you damaging other things or people theres simply a lot of stuff that you the driver could do that they cant account for in their numbers but will have to pay for if you screwed up but an automatic car not owned by an individual but by company trying to run a profit themselves with known software and hardware combinations known and predictable use cases secure storage facilities regular maintenance and user feedback reporting and a large data set provided by the company themselves that reports all incidents and not just the ones that the drivers do actually report thats going to lead to a much more predictable loss data set and you have a company to sue when it goes wrong suing a regular person for the money they dont have can be a hiding to nothing so the way i see it insurance companies cant wait to get their hands on the business model of automated drive and fleet pool car operations where the unknown human element is a much more manageable in the insurance press its been a topic of discussion for years with some people actually thinking the biggest resistance wont come from the insurance companies but from the population resisting having their freedom to drive taken away from them and from governments that will be slow to unpack the current insurance legislation and open it up to allow innovation in the market the insurance companies want more money for their shareholders they often do it by slicing the back end operation which i in operations hated them for it made people their own staff have worse quality lives all so the shareholders could benefit paying less in claims is a much much more lucrative option and may even stop them for a while from carving into themselves for the extra cash i think they want the automation they wont resist it its way too much good money
190,love it big insurance will fight it to the death instead of evolving with it and actually promoting safer transportation you have it backwards insurance pushes more car safety than government because it saves them money they dont ever lower their rates so self driving cars with virtually no accidents will be a profit windfall
191,big insurance will fight it to the death no theyll love it youll still need insurance for cars but with fewer crashes it would mean more free money for them sure some competition between car insurance companies but they will stay profitable theyll only start whining once the system changes completely and we really end up abolishing the need for car insurance when they are actually going to be obsolete
192,why would insurance be through the roof on a car that never crashes i work for an insurance agency and my boss thinks that auto insurance as an industry is about to get squished by autonomous vehicles removing the need for any kind of liability coverage maybe year to protect from vandalismnature otherwise whos going to hit you who are you going to hit no coverage needed kthnxbye
193,why would insurance be through the roof on a car that never crashes i work for an insurance agency and my boss thinks that auto insurance as an industry is about to get squished by autonomous vehicles removing the need for any kind of liability coverage maybe year to protect from vandalismnature otherwise whos going to hit you who are you going to hit no coverage needed kthnxbye
194,insurance rates being insanely more expensive once its proven that autopilot mean way more safety and less accidents will put an end to that
195,the biggest resistance wont come from the insurance companies but from the population resisting having their freedom to drive taken away from them i can totally see this happening especially in the us where people very strongly link car ownership with freedom our cities are built to basically require access to vehicular transit and its extremely limiting to not have it and its so stupid if i had a self driving car service id have to change nothing about my lifestyle as i age and my vision starts to deteriorate and my hearing fails and my reflexes just stop being what they used to be and i wouldnt have to ever worry about sudden car related expenses which can be disastrous to people on fixed retirement income this seems like nothing but a win if you plan on ever getting old compare to the number of elderly people in the us who end up trapped just existing in their homes because they cant drive anymore
196,i can see how modded interiors for self driving cars would be useful but with everything becoming subscription based and ownership giving way to rental its the only part of you take on the future that makes me hesitate personally id rather have a self driving car that i own over time and especially depending on the fees of such a service buying a car could be more cost effective based on my car payments i currently pay per day towards paying off my car another on gas per day then maintenance if broken down per day is maybe a lot less lets say per day so basically i pay roughly per day for my car once car payments stop and i fully own it that number is halved i wont count insurance or tolls as that may not be a huge concern in the self driving future my question is how much would a subscription car service cost i know a train ticket from my house to new york city near where i work is per day though monthly passes are available for per day so assuming a self driving car service exists it will probably be more than a train fare due to the convenience factor but must be less than a car payment gas lets say per day not bad but i still think the convenience of accessing my stuff outweighs the cost of renting a car every day and i think thats why a lot of people drive rather than take public transportation
197,fuck no we all cant at least i cant and i know others are like me maybe if i was in first class with some provided xanax with the legroom ive been on intentional flights too and just cant do it if they make cars that are private it wouldnt be half as bad especially if those cars at the concept with four seats facing into a middle area like a limo section if self driving is very reliable i see that being pretty normal or somewhat normal
198,me personally id rather have the freedom of driving myself even if it meant an increased chance of death or injury i know that seems silly to some but the fun and satisfaction i get from driving would outweigh the risk true that a self driving car would have prevented the accident sooner but i still prevented it if i couldnt have fully it would have just been a very survivable accident with little to no injury only a moderate fender bender the wrong doer would have benefited more than i because i saved her from hundreds if not thousands of costs in damages and insurance by stopping in time on top of that i felt like a fucking legend after the adrenaline wore off and very proud of my actions or reactions i should say i mean ive avoided accidents before but this one was on another level also how much do you reckon mandated self driving cars would cost certainly not everyone that can afford to drive a car today can afford one its gonna be hard fought to outlaw driving unless its an autopiloted vehicle again i agree with your take on ap cars but the world be live in today thats not readily attainable for most if it were that driver would have never made that illegal u turn unless they disengage ap and manually took over
199,guys what are you doing this is a bullshit puff piece written and paid for by the r street institute a republican and libertarian free market thinktank and media organization theyre clearly trying to slow the adoption of self driving cars for monetary reasons look at the authors http http theyve never written for slate before and are both from the r street institute the board of directors of this group includes steve mcmanus vice president counsel state farm insurance bob inglis executive director energy and enterprise initiative tevi troy president american health policy institute and is funded by pfizer amgen lkq credit union national association glaxosmithkline bayer verizon the wisconsin insurance alliance bbt pepsico farmers insurance group eli lilly usaa nationwide mutual insurance co renaissancere xl group allied world assurance co state farm diageo abir and general motors several of whom stand to lose big with the adoption of self driving cars these guys all got in a conference room and said to each other what can we dredge up about self driving cars which will look bad in the media thankfully this is the best theyve come up with so far
200,in other news arent we super close to d printing vital organs for transplants anyway on mobile so no link less vehicle deaths more organ transplants everyone wins except insurance companies
201,theres a lot of unforeseen things that driverless cars will bring i have two friends who work in injury and insurance law they say of their cases are car accidents expect push back from sociopaths whod rather pad their pocket than save thousands of lives
202,it will do more than that heres a map of the most popular job by state medianprorgassetsimgscreen shot at pm_wide ddbbdabcdedeefbdpng s self driving cars are tier one disruptive technology the likes of which we havent seen since the dot com boom many towns only exist because they get a stable stream of money through their truck stops there are million professional truck drivers in the us with roughly million in the workforce this alone threatens to almost overnight increase unemployment by or in other words it would go from to but if anything that understates it an additional work in the commercial shipping industry whose jobs are also at risk along with a large number of taxi and bus drivers millions of small time businesses depend on commercial shipping and the humans doing it to sustain themselves emts police and other emergency workers would see decreased demand along with insurance workers we often talk about jobs being displaced by technology but usually that hasnt been the case when horseless carriages showed up buggy driving as a career went away but new jobs popped up but this represents a rare tangible threat that will end jobs without the potential for new growth overall self driving cars are a huge net positive but like globalization it comes with large localized downsides that require vision and leadership to overcome a proper redistribution system would smooth out the peaks and valleys of both mitigating most of the problems they create
203,if only the organ donor registration was easier i know lots of people who want to be organ donors but the registration process is not complicated im sure some states have it easier than others oh and of course we have those religious nutjobs who say their religion doesnt allow them to donate their organs those religions that say things like that are directly responsible for many lifes that could have been saved i live in an area where i am surrounded by people whos religion tells them not to
204,if demand gets that high they could start selling extreme sport and manually operated vehicle insurance the cost your organs when you die and maybe like admin fee
205,i actually would have thought it was even more than in i always assume that tragic accidents were responsible for over half since those people would have more healthy in life than someone who died of a chronic disease
206,this is one of the most wonderful unintended consequences ive ever encountered you know who else is going to be hurting from this the funeral industry also automotive repair emergency rooms local law enforcement derived city revenue and both automotive insurance and personal injury lawyers bring on this brave new world i say my boss who i really loved and admired was killed in an mva in september she had stopped along with all traffic in her highway lane as a result of a fender bender several cars ahead of her and another vehicle ran into the back of her at high speed
207,i have a theory most of my friends think im nuts but if they can be programmed to pick to hit a dog rather then a human what will stop them from hitting the guy with type o who hasnt paid his life insurance
208,basically the only response to this should be promoting getting more people on the organ donor list theres really no objective reason to not be an organ donor being an organ donor is basically like buying free life insurance except the payout is life instead of cash
209,i am all for progress not progress that robs every citizen of its money uber has the credit cards numbers of millions of citizens it charges whatever they want and like whenever drivers they fluctuate unfair payment to drivers no insurance no benefits no maintenance fee is paid for the vehicles ford declared million in sales last year providing jobs worker welfare and basic a well being amongst it employees well being a good family life is what all of us is here for ubertakes your money
210,the reason we have an organ shortage is because its illegal to sell organs wed have a food shortage if it were illegal to charge for food too so why would organs be any different if we legalized markets in organs there would be a number of benefits probably lots more people would sell kidneys and thus everyone who needed a kidney could get one health insurance would presumably cover this extra cost so poor people who needed kidneys would still get them people who needed money could get some by selling a kidney families of deceased people could get some extra money by selling the organs of their deceased relatives rather than just donating them or more likely just buryingdestroyingwasting them living people could get extra money for nothing by just agreeing that their organs could be taken after their deaths selling organs is one of those things that sounds icky but when you think about it theres really no good reason to oppose it thats why a pretty large majority http kidneys of economists agree that kidney markets would be a good idea iran has a somewhat legalized kidney market and they have no waitlist for kidneys
211,i am on the transplant waiting list for a kidney for the second time in my life and very likely not my last my kidney failure was caused by a rare genetic disease where my own immune system attacked my kidneys beginning around the age of it is called dense deposit disease i would prefer than any life that can be saved would be however it can be saved i dont like the idea of this being referred to as an unintended consequence the intention is always to save as many lives as possible there are lots of different potential treatments on the horizon for esrd im personally looking forward to when we can produce an organ for a patient that cannot be rejected thereby eliminating the need for immunosuppressive medication these medications often create a whole host of other issues such as an extensive list of side effectsresulting in using medication to treat the side effects and increased chance of catching other diseases and illnesses during the time with my first transplant that didnt last long due to some of the aforementioned complications i got bk virus normal immune systems are exposed to this but know how to handle it shingles norovirus twice within a month and several other issues too plentiful to list now all in the short two years i had it to me the real solution is not more organ donors but instead more reliable treatments that provide a long term solution that does not require multiple transplants over the course of ones life i know people who are working on transplant number three or four
212,at this stage of self driving development they are simply being overly optimistic about its reliability but in time when in actual use there will likely be enough equipment malfunctions and software glitches to maintain the supply of human organs from chauffeured victims
213,i think that the day where manual labour is taken over completely by machines while corporate jobs are all practised from our very own homes through the internet thus making of all traffic unnecessary is closer by than the day where self driving cars could be considered remotely reliable
214,if its electric and self driving it literally costs me nothing to keep it besides the payment the insurance will be sitting cheap no recurring maintenance since there are only two moving parts i will own my own car its the leasing vs owning argument at the end i own something of value plus i do miles a year even at stupid low rates that will still cost a ton
215,every time someone posts this nonsense in this sub i have to assume they live in a big city where everything they need is within walking distance and they are so caught up in their own little world they have an inability to see the big picture nono its uber and lyft who will own a fleet of them and you will get rides in them for pennies on the dollar compared to todays prices first your assessment that it will be pennies on the dollar is so ridiculous its not even worth arguing but i am going to do it anyway its going to be more expensive not less the most obvious when was the last time a company lowered their pricing models because they got rid of the human element in fact how about any company lowering their established pricing models on anything in any industry for any reason you said pennies on the dollar that means that it is at the very least less than a standard rate so what you are saying is that a taxi ride thats what it is will now cost instead of even the most economically naive person could not possibly claim this with a straight face not as obvious from what i have read uber takes of the cut of each fare this mean they get for nothing more than hosting the app and creating the connection they do not own the car they do not pay for the fuel insurance or car payment so basically what you are saying is not only will uber charge less for the ride but they will also buy all the new automated cars pay all the fees cover all the maintenance insurance the responsibility and then lower the fee significantly right now as it stands with their cut uber etc are losing money a lot of money uber lost over two billion in so please explain to me how its going to be pennies on the dollar after they start picking up all the expenses that go with it at that point why would you want to own a car uber and lyft and all the other app services have existed since the automobile was invented they are called taxis there is literally no difference between a taxi and uber except one is legally licensed and regulated to do the work and is indemnified by an actual company the same reason not everyone rides in taxis is why people will still own cars whether they are automated or not this notion that everyone will have no issue calling up an automated car and waiting for it to arrive every time you want to leave your house work or the store is complete fantasy it works in a big city it doesnt work anywhere else i am in a suburb if i call a cab it will take at the very least minutes to get here this doesnt consider the fact that of the population goes to work at the same time they leave work at the same time they go to the grocery store the movies etc all in the same peak periods this means that there has to be an over abundance of vehicles or you have to ride share which would further hinder any time related needs and isnt in any way attractive to the average consumer a minute normal ride to a store to pick up some munchies turns into a minute thing with taxi rides this doesnt even touch the subject of where all these cars are going to be stored charged and maintained if everyone calls uber uber is going to need dozens of millions of cars if not hundreds of millions right now virtually every vehicle is in a garage a driveway imagine if uber needed thousand cars for just a small city in new york state where are they going to be stored how long will it take them to get to their call one last thing to keep in mind in terms of why every thing you do everywhere you go will be recorded good luck with that automated cars are frikin awesome cant wait to own one but they will not usher in a new age of non car ownership and taxi rides and they will not be cheaper there are literally other things i could list that blow everyones fantasy out of the water and you know them you just wont admit them
