,comment
0,i agree im not totally against the idea of a self driving car and i love the type of car service subscription you have described i just think it allows for the introduction of extraneous advertisements and serious drawbacks to the vehicles that might make me hesitant to use them if there was a service the way you described and they utilized it from the get go or even phased it in the way youtube ads have been for example i would be very hesitant to use the service not only is my psyche being manipulated so could my wallet or my waistline everyone is ultimately responsible for their own actions but imagine a lawsuit in which someone wants damages from the car service because it drove them by a mcdonalds every day since they liked it on facebook and their bank account shows a mcdonalds purchase x a week and now they gained a ton of weight and needed surgery it opens a lot of doors for too targeted advertising target and the pregnancy outing with their targeted ad and potential litigation were already bombarded with ads and have to try to use self control in some cases to avoid the impulse purchases to eat healthier etc why would we willingly engage any possible technology or features that could make it even harder to control
1,i drive past about companies a day as is as soon as i can possibly move ill be on a bike for about minutes vs hour in either case the point is the same the path worked out from an optimized fastest route lowest gas algorithm is the same if they bypass that they are losing money if they make so much money on driving the extra block or two past the thing that drives me wild so fucking be it that speaks volumes more about the pliability of the passenger let them spend it let yourself reap the rewards not everyone wins in any system why cry about the abuse instead of optimizing your own use of it
2,the difference in risk should be reflected in insurance premia for autonomous vs other vehicles thats it
3,my concern is cost even if ai gets perfected to the point that autonomous driving is demonstrably safer than humans tomorrow how much would that feature add to the cost of a car how long before you can get an old beater with ai will it even be something you can merely buy once or will it end up as so many things are as a costly subscription as much as id love a self driving car and as much as it would make the roads safer if everybody had one there are lots of people who will never be able to afford a new dumb car let alone a smart one the requisite hardware for autonomous driving would not only have to be good and reliable and safe it would also have to get cheap enough that it doesnt price entry level buyers out of the new car market and will have to be around long enough that there are plenty of old cheap autonomous cars available for those who cant afford new at a guess id say youd need to wait about years after autonomous cars became mainstream before even thinking about legislation even then youd have to start with merely requiring the feature for new model years like we did for backup cameras a few years ago maybe another decade after that you could start financially disincentivizing human driven cars insurance surcharges and whatnot in the end i dont think youll ever need to ban them theyll just become too old and too expensive for any but hardcore enthusiasts to bother keeping years after ai driving becomes a standard feature cars without the feature will be years old think about cars that are years old now would you want to drive one every day theyre so old that theyre either rusting into the ground or have gone through the old and cheap phase and come out the other side into the realm of expensive classics sooner or later cars without ai will be like cars without fuel injection or abs or air conditioning theyll exist but theyll all have historic plates and theyll only get driven to car shows
4,my concern is cost even if ai gets perfected to the point that autonomous driving is demonstrably safer than humans tomorrow how much would that feature add to the cost of a car how long before you can get an old beater with ai will it even be something you can merely buy once or will it end up as so many things are as a costly subscription as much as id love a self driving car and as much as it would make the roads safer if everybody had one there are lots of people who will never be able to afford a new dumb car let alone a smart one the requisite hardware for autonomous driving would not only have to be good and reliable and safe it would also have to get cheap enough that it doesnt price entry level buyers out of the new car market and will have to be around long enough that there are plenty of old cheap autonomous cars available for those who cant afford new at a guess id say youd need to wait about years after autonomous cars became mainstream before even thinking about legislation even then youd have to start with merely requiring the feature for new model years like we did for backup cameras a few years ago maybe another decade after that you could start financially disincentivizing human driven cars insurance surcharges and whatnot in the end i dont think youll ever need to ban them theyll just become too old and too expensive for any but hardcore enthusiasts to bother keeping years after ai driving becomes a standard feature cars without the feature will be years old think about cars that are years old now would you want to drive one every day theyre so old that theyre either rusting into the ground or have gone through the old and cheap phase and come out the other side into the realm of expensive classics sooner or later cars without ai will be like cars without fuel injection or abs or air conditioning theyll exist but theyll all have historic plates and theyll only get driven to car shows
5,there will be strict traditionalists that will always want to drive themselves they should be few in number and free to choose if one is objectively better that doesnt mean one should be illegal i dont envy their future insurance rates though
6,no if there was actual reliable public transportation throughout the country id consider it until then no fucking way
7,this is a delicate question it depends on a lot of factors there would be vast differences in attitudes between urban suburban and rural drivers their access to public transport would be vastly different as well and their access to features such as wireless charging accident avoidance infrastructure communication vehicle to vehicle for example would all be different based on whats available also there is a major set of people who enjoy driving this could continue via private roads though which would mostly be a large improvement in liability and safety driving could be a dedicated hobby which may prove out to be excellent compared to today
8,wont be up to us after a point insurance companies will demand it
9,being able to do this depends on the reliability of future autonomous vehicles their popularity and for a time public backlash from probably a fair number of drivers that wont want to give up driving this might turn into a heated political debate eventually in general no it would hugely sacrifice freedom to mitigate a level of risk almost all of us already accept let the transition to self driving happen naturally without bans or coercion
10,the elements of individual freedom dont matter we dont let people drive without a seat belt just because they want to because we understand how unsafe that decision is well rather because insurance companies leaned on the govt to write that into law because it saves them money on claims but it has the added benefit of also being the safer decision this kind of ban is a long time from being enforceable on a practical level though like literally decades were only now getting to the point where a majority of vehicles have current autonomous safety features lane departure prevention distracted driving warnings etc and thats not even fully autonomous realistically were probably years away from the point where most vehicles are fully autonomous thats the earliest i can see enforcing this kind of legislation and even then it would be more like states wont issue registration for vehicles that arent autonomous rather than an actual ban and some people will still try to ignore it because there will always be that segment of the population that arrogantly believes they can drive better than a computer
11,no but id support private insurance companies charging an arm and a leg if people want to continue driving them
12,at some point i would expect the manufacturer not the driver to be responsible for collisions and insurance since the driver isnt really driving
13,at some point i would expect the manufacturer not the driver to be responsible for collisions and insurance since the driver isnt really driving
14,the nature of insurance would change as well assuming the level of efficacy op is suggesting autonomous car owners wouldnt even be buying liability coverage because they wouldnt be liable for anything the car did that means insurance would be discretionary as opposed to today when youre required to have at least liability coverage insurers would have to make some kind of shift as that revenue is lost
15,the nature of insurance would change as well assuming the level of efficacy op is suggesting autonomous car owners wouldnt even be buying liability coverage because they wouldnt be liable for anything the car did that means insurance would be discretionary as opposed to today when youre required to have at least liability coverage insurers would have to make some kind of shift as that revenue is lost
16,the nature of insurance would change as well assuming the level of efficacy op is suggesting autonomous car owners wouldnt even be buying liability coverage because they wouldnt be liable for anything the car did that means insurance would be discretionary as opposed to today when youre required to have at least liability coverage insurers would have to make some kind of shift as that revenue is lost
17,yeah this is why im ultimately against it a ban would hurt the low income people today its not super rare to see vehicles from the early s and the s either because the driver is frugal or just too poor to upgrade in or whenever we have autonomous vehicles there will undoubtedly be many in the same position driving and cars and banning all non autonomous vehicles is effectively crippling these peoples ability to travel if we have reliable and affordable mass public transit everywhere then sure maybe but i doubt that will be the case
18,they should also be subject to criminal strict liability in the event that they injure or kill someone
19,i present to you the official pennsylvania horse and buggy operator manual in california the horse and the rider actually has right of way in many cases if the rider signals for you to slow down and you hit their animal youre held liable in fact they even have new safety laws that went into effect a couple days ago mandating helmets for under riders and reflectors on your horse when riding on the highway after dark new california traffic safety laws sideshows chp
20,what about the freedom of someone to drive a car they can fix themselves id imagine a lot of technology in self driving cars is proprietary and would stop people from having the ability to take personal responsibility of their own property or even have the liberty to use it on public roads
21,you dont need to be at fault personally to need insurance just at a loss if something bad happens businesses are insured through the hilt for everything
22,indeed thats what i mean by the end of liability insurance protecting yourself when youre found to be at fault you would still ideally insure the asset itself though like how today people opt for different amounts of collision coverage whatll be interesting is how responsibility is placed on manufacturers harm to passengers due to dangerous coding mistakes could be signed away as part of using the car but that wouldnt cover the pedestrian the car struck settlements with human drivers can be quick because no one wants to pay for a lawyer but settlements with an autonomous car manufacturer theyd just make life miserable for individual plaintiffsthere would need to be a class action suit after many people are hurt or some kind of regulatory regime
23,indeed thats what i mean by the end of liability insurance protecting yourself when youre found to be at fault you would still ideally insure the asset itself though like how today people opt for different amounts of collision coverage whatll be interesting is how responsibility is placed on manufacturers harm to passengers due to dangerous coding mistakes could be signed away as part of using the car but that wouldnt cover the pedestrian the car struck settlements with human drivers can be quick because no one wants to pay for a lawyer but settlements with an autonomous car manufacturer theyd just make life miserable for individual plaintiffsthere would need to be a class action suit after many people are hurt or some kind of regulatory regime
24,indeed thats what i mean by the end of liability insurance protecting yourself when youre found to be at fault you would still ideally insure the asset itself though like how today people opt for different amounts of collision coverage whatll be interesting is how responsibility is placed on manufacturers harm to passengers due to dangerous coding mistakes could be signed away as part of using the car but that wouldnt cover the pedestrian the car struck settlements with human drivers can be quick because no one wants to pay for a lawyer but settlements with an autonomous car manufacturer theyd just make life miserable for individual plaintiffsthere would need to be a class action suit after many people are hurt or some kind of regulatory regime
25,we dont because its too burdensome to subject people to that level of liability just so they can get around but if we had reliable autonomous driving tech people who choose not to use are volunteering for that liability
26,we dont because its too burdensome to subject people to that level of liability just so they can get around but if we had reliable autonomous driving tech people who choose not to use are volunteering for that liability
27,non autonomous cars arent but its easier to designate responsibility if something wrong happens yielding by default could be dangerous too as it doesnt take into account any other context car free future doesnt require knocking anything down just repurposing imo
28,non autonomous cars arent but its easier to designate responsibility if something wrong happens disagree its distressingly hard to hold reckless drivers to account and even harder to exact meaningful damages from them car free future doesnt require knocking anything down just repurposing imo most of the us isnt built at a density that can support reliance on public transit
29,dont generally worry about those things now anymore than i worry about buildings collapsing on me when i walk down the street we have laws signage and licensing for a reason we also teach our children to watch out for cars i worry about these things all the time because i live in a city where everyone drives like a raging psycho and routinely run down pedestrians without anyone being held accountable what i do worry about is my and my familys safety in the event of the failure of any one of the hundreds of systems required for autonomous driving clearly the technology is not there yet in terms of reliability but we will get there in any event non autonomous cars break too i worry that if the cascadia quake hits and cell service goes out then i cant get anywhere in my truck be it to get supplies like water or to get my family to our trailer an emergency manual failsafe would almost be the easiest thing in the world to include
30,if an autonomous car hits and kills someone who is liable the driver or the car manufacturer
31,manufactures will do everything possible to avoid this responsibility including encouraging only autonomous vehicles on the roads to make it peoples responsibility if they get hit rather than the manufactures
32,i dont think the replies are in favor of driving but more the freedom to have the option i personally would never drive again if this was a real option i hate driving but not as much as i hate police states and governmental over reach throwing axes in the middle of the street is just not an honest comparison ive driven my entire life and never killed a single person most people have in fact but if i started throwing axes in public id probably injure or kill someone in less than a week good drivers who honestly enjoy driving or perhaps just dont trust automation shouldnt be punished for other peoples mistakes just like we dont ban driving on holidays because its the time when the most drunk drivers are out we punish the individuals responsible not the entire society
33,i mean we are already talking about an environment where the only motor vehicles allowed are autonomous im sure the law will be updated to clarify that its the manufacturers responsibility to make sure their cars avoid these types of collisions
34,those types of techniques can certainly reduce the incidence of false positives but in situations with enough vehicles and specular reflective surfaces your system can easily have very low confidence i used to work with vector templating system that can auto align using lasers and retro reflective material and even with all the tricks we lock out the ability to align two heads at the same time that are too close together these types of visual systems are very sensitive to interference i mean i worked on systems that needed thou accuracy on stationery mounts but i can certainly see a half dozen lidar scanners in very close proximity causing enough interference to atleast lower the confidence enough to make them significantly less reliable not to mention due to the fact that if a company wanted to use visible light lasers for improved range eyesafe and r systems are still incredibly distance limited for dynamically mounted sensors generally use at least other machine vision technology is needed to have adequate active track most of the vehicles that i have seen equipped with lidar systems are also using or other additional methods like machine vision with cameras and actual radar there is a reason we dont see automotive lidar on vehicles outside of experimental self driving applications and close to the ground warehouse autos controlled by a single server or coordinated through a hivemind iot architecture that is also supported by a server teslas decision to forgo lidar altogether didnt happen by accident its far easier to coordinate disparate devices when the scanners you are using arent emitters
35,you bring up good points i actually work on lidar for vehicles in my current position and so far i dont know of any oems that plan to rely on only one sensor type for the autonomous driving systems besides tesla using vision only lidar has its place in the sensor suite but a lot of the hard work happens at the sensor fusion level and the ai built into the computers taking all the sensor data in and processing it those systems can identify when they are in a situation where the lidar is not the most reliable sensor to take data in and adjust accordingly in the short term lidar is an improvement in safety for collision detection and automatic breaking systems to avoid the collision vs the existing sensors so it helps to enable the intermediate autonomous driving levels before getting to fully autonomous operation
36,i know that stroke victims with damage to brocas area the area mostly responsible for speech production are often aware of their cognitive disability ive heard it described as having the sensation of having a word on the tip of your tongue but its every word all the time and being unable to find it
37,insurance on the other hand becomes a much trickier problem
38,cars would stop whenever a pedestrian approaches and not whenever they feel like it maybe also accidents happen all the time with human drivers too the quesiton is who is more reliable but yes public transport would be suerior oc
39,this was peak dumbass when people started believing this shit was possible ok so your plan is to replace cars and service vehicles with tech that remotely doesnt exist mind you despite your highway auto features you think are even close this level and make sure they can all reliable communicate with each other and a new grid and all software companies will play fair and every car owner will keep up maintenance to for community integrity and thats just to start i have an idea for an electric vehicle that can use less space carry way more people and still get you where you want to go safer and more efficiently than this dystopia you imagine choo choo choo mother fuckers choo choo choo
40,thats the beauty of self driving cars they drive super defensively for insurance reasons just walk out into the street the cars will just start slowing down
41,they dont want you or anyone to be a pedestrian spend money on a car insurance and pay tolls
42,hey ive work in automation for a long time and the solution would be very simple push a button that will activate a series of software logic events to alert cars in a certain radius a human is walking across the intersection the way i would do it is all algorithms that predict the vehicle is going to intersect or potentially intersect a human will be put into a safety mode basically slows the car down a lot emphasizes the camera systems to verify path isnt blocked and overall put each vehicle in a certain vicinity on a high alert for potential human injury once the systems for the cross walk verify all humans are across and the pathway is safe it will eliminate the high alert program and fall back into its routine by the time this is a thing all cars in a square mile radius will communicate will all other vehicles they will constantly be sharing vehicle speeds locations destinations future predicted routes and all kinds of things with every car around them and an extremely strong computer quantum computer possibly will make corrections to the flow of traffic accordingly we have many years before we eliminate stop lights and order traffic rules but when it happens its going to be super cool plus robots are x more reliable than a human could ever imagine
43,since we have no clue how cognition ie the abilty to think and reason works in a biological brain we have no ability to create machines that have that ability either deep learning algorithms and neural network software do not and cannot have this ability regardless of how much training data you throw at it a child knows the difference between a real stop sign and a stop sign on someones clothing they also know that a stop sign is still a stop sign even if it has a sticker or some graffitti on it these so called improperly named ais do not know the difference furthermore any so called self driving car that has to randomly pull over to the side of the road and stop then call a remote human operator to guide it manually through whatever it is it cant handle is not in any way shape or form ready to be responsible for the safety of human occupants or be allowed on public roads its all a failed technology that will never be ready for real world use these companies all know this but have invested so much money in the development that they insist on marketing it anyway to recover that money or go bankrupt dont fall for the self driving car meme
44,you cannot unless you buy a self driving skateboard available from various manufacturers also need registration insurance and dl for the skateboards
45,this would suck and all but the software would be more reliable than humans
46,knowing elon musk hed invest in this immediately if he could also knowing musks great track record with reliability itd have a death rate
47,liability is going to be a problem though now even if a car completely malfunctions resulting in an accident the driver is still mainly responsible for any accidents car manufacturers would be held liable for any accidents caused by self driving cars and they dont want that
48,liability is going to be a problem though now even if a car completely malfunctions resulting in an accident the driver is still mainly responsible for any accidents car manufacturers would be held liable for any accidents caused by self driving cars and they dont want that
49,liability is going to be a problem though now even if a car completely malfunctions resulting in an accident the driver is still mainly responsible for any accidents car manufacturers would be held liable for any accidents caused by self driving cars and they dont want that
50,hm i beg to differ in this one unreliable equipment that doesnt kill en masse is fine but this is a little over the top since the payers for this system are rich and could net us more profits what i say we do is create a free system for crossing that has a death rate then let people pay for ones with lower death rates getting gradually more safe the more youre willing to pay
