,comment
322,i agree and its not just reddit its the industry too a colleague went to a transportation conference and shared his experience with us almost everything was about autonomous cars with very little emphasis on public transit or how the tech can be applied to public transit networks in an ideal world id like to see the tech improve existing public transit with cars filling in the gaps that arent covered adequately like the person who commented about his shiftslocation in this thread its sad because i really believe that this tech can provide cheap reliable and efficient transportation with no reason for anyone to own a car but it seems like the focus is on everyone owning a driverless car that will sit in the lot of the time in other words how can we sell as many cars as possible
323,yes but the purchase price is a known factor that you can take into account during your decision to buy the manufacturer should know the risk of the system they have built and so have a basis for how much that liability will be for the life of the vehicle but theres zero chance of any consumer being able to independently evaluate that liability before or after purchase in the manufacturer pays case if a manufacturer is liable and understates the risk then their insurance provider will charge them more or refuse to cover it the consumer might lose some of the value of their car because they get a poor reputation for safety but in all likelihood it will be in the manufacturers best interests to remedy the problem asap as well as the consumers in the customer pays case the customers are accepting an unknown and unknowable amount of liability when they purchase such a vehicle the insurance premium could go through the roof they could effectively be rendered uninsurable and the only incentive for the manufacturer to fix anything is bad press or if they are forced into a recall
324,yes but the purchase price is a known factor that you can take into account during your decision to buy the manufacturer should know the risk of the system they have built and so have a basis for how much that liability will be for the life of the vehicle but theres zero chance of any consumer being able to independently evaluate that liability before or after purchase in the manufacturer pays case if a manufacturer is liable and understates the risk then their insurance provider will charge them more or refuse to cover it the consumer might lose some of the value of their car because they get a poor reputation for safety but in all likelihood it will be in the manufacturers best interests to remedy the problem asap as well as the consumers in the customer pays case the customers are accepting an unknown and unknowable amount of liability when they purchase such a vehicle the insurance premium could go through the roof they could effectively be rendered uninsurable and the only incentive for the manufacturer to fix anything is bad press or if they are forced into a recall
325,yes but the purchase price is a known factor that you can take into account during your decision to buy the manufacturer should know the risk of the system they have built and so have a basis for how much that liability will be for the life of the vehicle but theres zero chance of any consumer being able to independently evaluate that liability before or after purchase in the manufacturer pays case if a manufacturer is liable and understates the risk then their insurance provider will charge them more or refuse to cover it the consumer might lose some of the value of their car because they get a poor reputation for safety but in all likelihood it will be in the manufacturers best interests to remedy the problem asap as well as the consumers in the customer pays case the customers are accepting an unknown and unknowable amount of liability when they purchase such a vehicle the insurance premium could go through the roof they could effectively be rendered uninsurable and the only incentive for the manufacturer to fix anything is bad press or if they are forced into a recall
326,im actually pretty optimistic about self driving being safer than the average human but like any new tech we need to make sure its properly regulated and like any business model we need to make sure liability and profit are in the right places in order for the market to function to the general good there will be cases where a self driving car will kill someone that an alert human driver would not there will hopefully be a lot more cases where a self driving system will avoid a fatal incident that a distracted driver would not the former will be easy to measure and should be properly investigated the latter we will only be able to understand statistically that doesnt mean that we should give more weight to the former but it does mean that we need to carefully and continuously weight the costs and benefits of using such automation when competing implementations exist we need to ensure that the most financially rewarding option for manufacturers is to continually improve safety not to pass liability to blameless consumers or hide behind hard to measure statistics placing the liability for such incidents squarely on manufacturers is the only way to adequately incentivise the behaviour that we want to see
327,for some reason i enjoy the idea that if someone kills me and its their fault theres atleast someone responsible and potentially punished for what he did if some self driving tesla kills me im collateral damage for testing out software musk wont be responsible if that happens nothing will happen
328,this will be solved by selling cars as a service not a product you pay a monthly bill and the manufacturer will provide you with the car you cant modify it and they will do the maintenance and even replace the car regularly the manufacturer will be accountable for every accident and killing and they will hire the insurance
329,my father used to work on car insurance and even without that kind of in depth information just with seeing the cars involved hearing what happened he could tell what really happened he would know exactly how the accident took place and spot people lying one time my sister crashed and she wasnt able to describe the accident well my dad saw the car and immediately knew what happend explained it to my sister and she was like yeah that was it
330,machine learning will take care of insurance claims download data run its function out the claims
331,if you pay for the vehicle yes many companies have stated they assume responsibility but even then the price is built in do you expect to not pay for damages you cause
332,i doubt you can be liable if you loan your note to a friend and it explodes in their face
333,theres different auto insurance coverages though theres comprehensive collision medical payments liability etc i suspect the one most are posting about is the liability portion and its perfectly reasonable to assume the manufacturer will take that on while the owner will still maintain things like comprehensive which would cover the car if its sitting in the driveway and a tree falls on it
334,theres different auto insurance coverages though theres comprehensive collision medical payments liability etc i suspect the one most are posting about is the liability portion and its perfectly reasonable to assume the manufacturer will take that on while the owner will still maintain things like comprehensive which would cover the car if its sitting in the driveway and a tree falls on it
335,near chance insurance companies dont lobby to make sdv insurance mandatory paid by vehicle owner at least stateside chance insurance rates dont end up higher than now no matter what the insurance lobby is strong very very strong
336,somehow auto insurance companies will find a way to say with a straight face that self driving cars are more expensive to insure and traditionally driven cars are also more expensive to insure with self driving cars on the road alongside them that way auto insurance rates can continue to do what theyve always done
337,those with sdvs will eventually deem insurance unnecessary you will still want comprehensive insurance if youre afraid of being hit by someone else who doesnt have insurance
338,i actually think it could go up on average as those without sdvs will be seen as a much higher risk thats not how it works insurance is already priced to account for the risk of human drivers if any thing that risk goes down as there are more self driving cars on the road
339,bad argument is bad who pays for insurance is irrelevant to we need to accept imperfection because automated cars are many times safer than we are your question is about a very specific instance that has nothing to do with the article at all
340,the one assumption that was made in the title was that it would decrease accidents that means its better than the average driver insurance rates are based on those statistics so its not really dependant on how you drive yourself so youre rate will go down if you use their system because the assumption is that its really good you dont pay for a fuck up system because the system isnt fucked up if something happens where the car gets in an accident the insurance company will pay it
341,insurance companies already divide people into risk groups and charge different rates based on that
342,then you will be the worst driver on the road and your insurance will cost x what it used to and everyone will tell you and your kind to get the fuck off the road because your fucking up the program just like bike riders get
343,in my perfect dream of the future self driving cars come with insurance as part of the car the manufacturer programmed the car they are responsible for accidents and will make deals with insurers before the car is sold there may be a need for supplemental insurance for those who elect to drive the car themselves it may become normal routine in the future that the operating mode of the car during the crash will need to be determined to indicate which insurance policy will be used
344,in my perfect dream of the future self driving cars come with insurance as part of the car the manufacturer programmed the car they are responsible for accidents and will make deals with insurers before the car is sold there may be a need for supplemental insurance for those who elect to drive the car themselves it may become normal routine in the future that the operating mode of the car during the crash will need to be determined to indicate which insurance policy will be used
345,why would this be true i would assume your insurer is liable or the car manufacturer or software vendor would be liable makes no sense for an individual to be personally liable for the actions of the software
346,that is not a resolved legal issue it could go the trainbus route of passenger liability in fact with level automation thats the only viable option
347,the problem really is that self driving technology will diffuse responsibility for deaths that it causes lets say that a self driving car kills someone and later its proven in court that if the programming had been slightly different the death wouldnt have occurred who is at fault for that do you blame the programmer what if its a team of programmers who all collaborated to write the software what if they were just programming the way the middle management told them to what if middle management was just trying to adhere to strict deadlines set by the ceo what if the ceo says he has to have those deadlines to fulfill his fiduciary duty to shareholders et al when an entire company is at fault the responsibility is diffused and the only real solution is that the company pays a settlement to the family of the dead this allows for companies to get away with murder if the settlements are less costly than improving their software
348,the real kicker is that it will actually jack up your manual insurance prices self driving cars cause less accidents and the manufacture is sued they will be pooled seperatly as more people use them there will be less people in the manual pool these people also have more liability as each death does not cost an insurance company the same amount an automated car can make a mistake but it cant be negligent negligence texting drinking etc cost more with fewer people pooling money to cover larger liabilities your premiums will skyrocket at some point choosing to manually drive could be considered a risky behavior as well as unsexy as it sounds rising insurance premiums will be the force behind the adoption rate of this tech
349,the real kicker is that it will actually jack up your manual insurance prices self driving cars cause less accidents and the manufacture is sued they will be pooled seperatly as more people use them there will be less people in the manual pool these people also have more liability as each death does not cost an insurance company the same amount an automated car can make a mistake but it cant be negligent negligence texting drinking etc cost more with fewer people pooling money to cover larger liabilities your premiums will skyrocket at some point choosing to manually drive could be considered a risky behavior as well as unsexy as it sounds rising insurance premiums will be the force behind the adoption rate of this tech
350,the real kicker is that it will actually jack up your manual insurance prices self driving cars cause less accidents and the manufacture is sued they will be pooled seperatly as more people use them there will be less people in the manual pool these people also have more liability as each death does not cost an insurance company the same amount an automated car can make a mistake but it cant be negligent negligence texting drinking etc cost more with fewer people pooling money to cover larger liabilities your premiums will skyrocket at some point choosing to manually drive could be considered a risky behavior as well as unsexy as it sounds rising insurance premiums will be the force behind the adoption rate of this tech the older cars will be abandoned
351,the real kicker is that it will actually jack up your manual insurance prices self driving cars cause less accidents and the manufacture is sued they will be pooled seperatly as more people use them there will be less people in the manual pool these people also have more liability as each death does not cost an insurance company the same amount an automated car can make a mistake but it cant be negligent negligence texting drinking etc cost more with fewer people pooling money to cover larger liabilities your premiums will skyrocket at some point choosing to manually drive could be considered a risky behavior as well as unsexy as it sounds rising insurance premiums will be the force behind the adoption rate of this tech the older cars will be abandoned
352,its a pretty meaningless distinction the insurance will pay who directly pays for the insurance is also pretty meaningless because regardless the cost gets passed along to the end user
353,it will be nobodys fault in practice car manufacturers will be releasing a financial report every year with one more line in it insurance payments
354,ya thats what i was thinking too these insurance companies are huge and basically print money theyre not just gonna roll over and start making a shit ton less money
355,why would the insurers care who pays them it could be the end user as a customer or a car manufacturer at any rate people will still need liability coverage natural disaster coverage theft coverage glass breakage coverage mechanical issues coverage etc
356,i get what you are saying but businesses are always expected to make bigger and bigger profits i can see prices for insurance of both sdvs and non sdvs will be disproportionate to actual risk so the insurance companies continue to make bigger profits
357,originally you said things are going to be perfect over time and now youre saying they are perfect now the fact of the matter is automated cars are not monolithic there are many ways of constructing different automated cars and many varying conditions under which they may operate you are basically saying automated cars are magical therefore we wont need insurance how is insurance relevant to a ridiculous article which completely ignores huge glaring facts you ask thanks im glad you asked that well we live in a world where accidents happen an imperfect world at least i domaybe you live in a perfect world so basically the world that most people live in involves insurance so while a year old gizmodo or nextweb or whatever author may wish something to be true its not yet true and may not be true for years or even years because differing technologies take different rates to mature the past does not predict the future and just because weve had one type of computing revolution which happened in one decade does not mean that any other potential technology revolution that we happen to like will necessarily happen at the same pace in another decade sad but true personally im guessing we will see a wide adoption of commercial partial automation of large semi trailers on certain highways in certain times of the years and certain weather conditions via optical sensors in years but i could be wrong it may be more like or and it may require a lot more expensive sensing equipment which granted may take less time to come down in price but we as laypeople dont know that right now therefore insurance law will need to adapt over time and insurance will not become irrelevant in likejune of this year its completely relevant and in fact its codified into the law at least in my state and im willing to bet every state
358,this works only if the communications are reliable and trustworthy however they are not imagine what you could do by screwing with inter car communications on demand traffic jam no problem i think that self driving cars will be forced to rely almost entirely on internal sensors for the foreseeable future which doesnt mean there wont be any improvements to traffic flow simply due to better situational awareness and faster reactions
359,i assume that before that the cost of insurance for manually operated vehicles will be prohibitively expensive long before its actually banned
360,your insurer is never liable as they had nothing to do with causing the accident they reimburse costs based on which driver is liable and currently all automous cars have a driver or operator that is liable for the operation of the vehicle maybe this will change in the future to shift some liability to the manufacturer but we arent there yet
361,your insurer is never liable as they had nothing to do with causing the accident they reimburse costs based on which driver is liable and currently all automous cars have a driver or operator that is liable for the operation of the vehicle maybe this will change in the future to shift some liability to the manufacturer but we arent there yet
362,i like that train of thought but i dont put much stock into that being a thing in my life time multiple owners of one car means there will be times when you cant use it uber style would be more expensive than owning unless you travel very short distances very rarely like leasing a car whether you own a car or partake in a futuristic uber program you essentially pay per mile you drive even when you factor in selling the car eventually changes a little if you dont drive much with uber style the cost per mile is unavoidably higher because you have to pay for someone to clean it the technological infrastructure and wages to make car sharing possible insurancecost splitting in case people vandalize or damage the interior or exterior someone to do simple everyday maintenance like change the wipers and the cost disadvantage of buying a new car if youre someone who usually buys used cars then factor in the fact that the company organizing the scheme and any companies involved with aspects of it would be trying to turn a profit youve got more middlemen between you and the manufacturer if elon musks automation scheme works out and cars end up getting way cheaper in the future the cost disadvantage for uber style ownership might be less of an issue but actual ownership will always be cheaper
363,so will all cars in the future have indefinite warranties at what point is your car your responsibility which is why a lot of places have yearly emission checks so at some point will those test all aspects of the car including self driving
364,right and if its their fault so their insurance will pay and their premium potentially is adjusted
365,the real question is once self driving cars are adopted en masse will we even need insurance companies or would car manufacturers function as their own insurance company a car manufacturer could see the statistical number of accidents their self driving cars cause see the average cost of them and simply say to customers if our car is driving and causes an accident well pay for it then price those payments into the cost of the cars they sell at that point people would only buy insurance to cover their car in the event that you are hit by someone else who has no insurance or if you insist on driving it yourself
366,car manufacturers wont just start paying insurance they have never had to pay before either the easiest and best solution for keeping money in both insurance companies and car manufacturers pockets is for end users to simply continue to pay for it
367,i get what you are saying but businesses are always expected to make bigger and bigger profits thats no different than today i can see prices for insurance of both sdvs and non sdvs will be disproportionate to actual risk so the insurance companies continue to make bigger profits you keep saying stuff but youre not providing any logic or reason for it
368,let me put it this way hypothetically when you get the car with no steering wheel the manufacturer will make you sign a waiver saying that you can buy the car but you accept the risk that it will get in an accident through countless years of experimentation they prove that by using their system you are less likely to get in an accident but if you do get in an accident you will be liable unless of course someone elses car hit you so youre choices are use their system and accept the of getting in an accident that you already agreed to be liable for dont use their system and drive yourself and accept the more risk of getting in an accident youre liable for both choices result in you being liable but option means your much less likely to get in an accident not only that but insurance companies will look at those statistics and greatly reduce your premium if you choose since they are less likely to have to pay you out conversely if you choose option your premiums will be much higher because the odds that they have to pay up are higher hope that helps explain why the driver will always be liable in the case of sdc accidents their system doesnt half to be perfect it just has to be better than people
369,let me put it this way hypothetically when you get the car with no steering wheel the manufacturer will make you sign a waiver saying that you can buy the car but you accept the risk that it will get in an accident through countless years of experimentation they prove that by using their system you are less likely to get in an accident but if you do get in an accident you will be liable unless of course someone elses car hit you so youre choices are use their system and accept the of getting in an accident that you already agreed to be liable for dont use their system and drive yourself and accept the more risk of getting in an accident youre liable for both choices result in you being liable but option means your much less likely to get in an accident not only that but insurance companies will look at those statistics and greatly reduce your premium if you choose since they are less likely to have to pay you out conversely if you choose option your premiums will be much higher because the odds that they have to pay up are higher hope that helps explain why the driver will always be liable in the case of sdc accidents their system doesnt half to be perfect it just has to be better than people
370,lol nah yeah should have put only one pedestrian however they still are far safer than human drivers and the technology hasnt even been perfected yet lemme ask you though that subset of the population that can only afford to get to work in their dollar beater we kill those people right or do you have some magical thinking ubi bullshit that miracles that problem away too uhhh no itll take a bit for them to become mainstream but once it is we can just have services where you order a self driving car from your phone kind of like an automated uber and if you want to buy a car theyll be the only thing available theyll end up being affordable and actually carry far lower insurance premiums of course most jobs are going to be automated out of existence and well start feeling more and more of the pressure when these come out especially since theyll kill a lot of transport industry jobs ubi or some other program is going to be necessary when most people are out of work
371,your warranty is now void i am not responsible for bricked devices dead sd cards thermonuclear war or you getting fired because the alarm app failed please do some research if you have any concerns about features included in this rom before flashing it you are choosing to make these modifications and if you point the finger at me for messing up your device i will laugh at you someone more clever than me needs to modify this to work for cars
