,comment
482,my prediction is that we will move towards cars as a service you lease a car from alphabetteslawhatever that chinese one is for years so they have all rights to the programming and you cant modify the vehicle they will also want control over how often its maintained and so they can demand the sensors be repaired with this lease some will just throw in the insurance because itll be cheap and marketingaccounting will say its a good deal for us
483,why as a human youre much more dangerous other people are at risk even to the extent that compulsary rd party insurance removes the risk of you costing other parties money theres still the risk you could maim or kill them should people still have the option to drive extremely old unsafe cars in many juristictions classic car enthusiasts arent allowed to take their old cars on the roads also synergy between autonomous vehicles means the road networks will work better without human drivers even a small number of human drivers will cause problems
484,oh no thats pretty fair i backed into a parked vehicle and i got pulled over for speeding without my address on my license updated or my renewed insurance in the vehicle and i havent been driving that long but even before that it was still almost
485,sounds about right then also there is a huge difference if you have full coverage vs just liability if you have a newer car chances are you are forced to have full coverage whereas my classic car only costs about sounds like you have full coverage
486,that only happens in markets where there is either a lot of competition or easy barrier to entry unfortunately it seems like the majority of markets today have neither that being said if major car companies opted for their own insurance that would create more competition which has a possibility of dropping rates
487,there is quite a bit of competition in car insurance markets today and if the driver less car companies banded together they easily have enough capital on hand to start their own insurance company if they desired to
488,sorry i was talking more generally yes there is a lot of competition with car insurance that ideology doesnt work in every market though which was the point i was trying to make p
489,good point many people dont have the vaguest idea how reliable specifically designed hardware and embedded software are they think its going to be as reliable as their home pc when its much closer to being as reliable as a hand held calculator i doubt any of us even know someone who had a hand held calculator ever return the wrong value
490,people arent really the problem honestly if you give people the ability to have a self driving uber show up at their door and drive them wherever they need to go whenever they need to go for a fraction of the cost of automotive ownership people will use it in droves the problem is all the industries people having that level of convenience and safety disrupts those industries auto manufacturing petrochemical insurance rely on every commuter needing or wanting their own personal vehicle they dont make enough money otherwise and if that means they keep driving over a million dead bodies most of whom are children a year to do it thats exactly what theyre going to keep doing and why they bribe governments to kill self driving technology
491,the argument tends to boil down to x amount of people die from y so we should ban y while im sure there wouldnt be an explicit law banning older not self driving cars i worry that it would be prohibitively expensive through either insurance or fuel cost
492,insurance companies wont like that how can you be legally pressed to pay them their monthly extortion installments if you arent legally responsible for an accident caused by the vehicle
493,insurance companies wont like that how can you be legally pressed to pay them their monthly extortion installments if you arent legally responsible for an accident caused by the vehicle
494,if the car manufactors make an ai to drive then we can hold the cars individually responsible that will teach them
495,my cousin is a legal expert in autonomous vehicles and apparently the reality is somewhere in between it relies on what level of autonomy the vehicle has level full autonomy but requires user supervision in the case of error the user is legally responsible ie liable in a claim level full autonomy with not requirement for user supervision manufacturer is responsible
496,my cousin is a legal expert in autonomous vehicles and apparently the reality is somewhere in between it relies on what level of autonomy the vehicle has level full autonomy but requires user supervision in the case of error the user is legally responsible ie liable in a claim level full autonomy with not requirement for user supervision manufacturer is responsible
497,so we would need to buy the car from the manufacturer and the insurance too
498,the issue with self driving cars is that they can only see so much in some cases they cant tell what a shadow is if theres a lorry turned over if a car is parked on the side of the road just to name a few end of the day until all cars are self driving i believe that it should always be the drivers responsibility as theres sometimes a need for the driver to take over
499,obligatory rfuckcars ice cars are on their way out it is antiquated technology instead of addressing the significant problems caused by mass car adoption health public space injury to others microplastic pollution carbon emissions noise pollution etc there is a lot of pressure to just transition to self drive electric cars understand this is mostly to keep in the pockets of automotive companies insurance companies etc i like cars and outside of the city are often necessary because of the lack of public transport options but i recognise that companies like tesla and such keep trying to reinvent the bustramstrains but worse
500,liability is a problem sure self driving reduces accidents by something like but thats still a lot of death every day for a company to take on by itself its already very unlikely that your fatal car accident makes it to local news beyond the traffic report they happen so frequently
501,its not just ethically who is in control but given that everybody with a self driving car will need to buy insurance then its one of the most cost effective ways for owners of self driving cars to take out insurance who is going to get the better deal a billion pound car manufacturer or you on your phone to somebody who is reading a script they likely have zero legal training to understand and even if they did theyre employed to rip you off in the ideal world the government would be in charge of taking our insurance policies for us all because we have a democratic say in what that decision they make but the second best option is for the car manufacturers
502,here in the usa we had a case where one of the people in one of these self driving cars was basically thrown under the bus by the car company saying it was their fault it was really sad the person who was the test driver was a trans woman and had multiple felonies for various non violent things obviously this person struggled a lot in their life and got this job of being a test driver because there really didnt need to be any qualifications all they did was sit in the drivers seat and they were to intervene and take manual control of the car if something went wrong xb well this poor person was arrested thrown in jail and slandered after some crackhead basically ran themself into the car effectively killing themself the car company forget the name i think it was waymo blamed it all on this poor person saying they should have been paying attention and steered away they had video from inside the car of course and the tester was just sitting there playing on their phone when suddenly out of the blue comes some person on a bike straight into the car this happened so fast it was pretty much two seconds from when the camera sees the person on the bike to the impact this also happened at night so it is unlikely the test driver even if they werent staring at their phone would have seen much less been able to anticipate thebike riders actions not to mention the car had the headlights on and could clearly be seen yet the bike rider still drove immediately in front of them which to me seemed to indicate they probably werent perceptually aware enough to understand the vehicle was closer than they were thinking it was xb long story short the test driver was sent to jail for manslaughter and nothing happened to the company they took no responsibility
503,for all autonomous cars are fantastic i dont see it happening any time soon and mostly for the reasons around morality the question is not if the question is when does the car protect the driver in all instances or a pedestrian does the car preference an older person over a younger one does the car preference a pregnant woman or a couple there will be situations where death of someone is nearly assured and what the car decides will be out of the hands of anyone involved in the crash and likely the systems and its inbuilt morality will be based on the morals of a different country likely the us or japan regulation is also an absolute nightmare and i find it really surprising that we are so convinced by self driving cars when self driving trains are still not the norm whos liable is just a fraction of these huge issues
504,it might be obvious if the cars were always self driving the problem is that at the moment they are only partly so and that will probably continue for a long time this means that the car will hand control over to the user at times and may do so at short notice when the user is not paying attention if a crash results is that going to be legally the fault of the user or of the company which designed the car which handed over control while the user was pouring coffee if the company goes out of business must any cars of that brand be taken off the road despite a good safety record i can see the arguments for holding the company entirely responsible and i used to take this line now i think that it cant be simplified that much
505,isnt the owner responsible for maintenance
506,easily the manufacturer will insure the car and you will pay monthly subscription fees to use it it stops becoming owned and you will use the car as a service as we do it more and more with software insurance companies can stop caring about everyday users and only do business with companies which is way easier and more lucrative anyway
507,this should all but kill the car insurance industry except maybe damage theft if possible and battery insurance
508,fire theft damage and legal protection insurance companies would still make sure they got the same profits but it would be a bigger percentage of the total payment
509,these cars are likely to be effectively robot driven cabs you dont pay for insurance when you hire a cab get on a bus or a train and you arent responsible if the driver has an accident that you didnt cause as others have said the future is going to be cars as a service rather than buying them i want to go to the shops open an app the car shows up and takes you where you want to go and leaves that helps solve the problem of people not having driveways or places to charge their cars too
510,these cars are likely to be effectively robot driven cabs you dont pay for insurance when you hire a cab get on a bus or a train and you arent responsible if the driver has an accident that you didnt cause as others have said the future is going to be cars as a service rather than buying them i want to go to the shops open an app the car shows up and takes you where you want to go and leaves that helps solve the problem of people not having driveways or places to charge their cars too
511,you dont think car insurance should be a legal requirement
512,i would say if i buy a car and let it loose on the road and it smashes through a shop window it would be my responsibility since i was the one who directed it i would need insurance to cover the cost the insurance company could then try to recover their cost from either myself or the manufacturer also if i do not keep it maintained eg bald tyres which causes an accident when the vehicle can not break in time then i would be responsible for the accident
513,i would say if i buy a car and let it loose on the road and it smashes through a shop window it would be my responsibility since i was the one who directed it i would need insurance to cover the cost the insurance company could then try to recover their cost from either myself or the manufacturer also if i do not keep it maintained eg bald tyres which causes an accident when the vehicle can not break in time then i would be responsible for the accident
514,i would say if i buy a car and let it loose on the road and it smashes through a shop window it would be my responsibility since i was the one who directed it i would need insurance to cover the cost the insurance company could then try to recover their cost from either myself or the manufacturer also if i do not keep it maintained eg bald tyres which causes an accident when the vehicle can not break in time then i would be responsible for the accident
515,i am guessing manufacturers will always make cars that dont quite fit what ever definition of fully automated they come up with that way there will be more wriggle room in terms of their liability but maybe not
516,is that going to be legally the fault of the user or of the company which designed the car which handed over control while the user was pouring coffee this isnt what current semi autonomous vehicles are meant for as much as i think the tech is dangerous i cant really blame the manufacturer when people fail to follow what is legally required of them if the company goes out of business must any cars of that brand be taken off the road despite a good safety record i can see manufacturers being required to have insurance covering this or for all of them to pay into a single pot to cover it
517,it does not matter if the car takes control from the driver then the company is responsible the same way that i would be responsible if i grabbed the wheel from you on the m and steered into the middle lane either the driver is in control or the driver is not if companies want to backpedal on how advanced their self driving actually is then they are free to do so but that should not absolve them of responsibility for their actions
518,it does not matter if the car takes control from the driver then the company is responsible the same way that i would be responsible if i grabbed the wheel from you on the m and steered into the middle lane either the driver is in control or the driver is not if companies want to backpedal on how advanced their self driving actually is then they are free to do so but that should not absolve them of responsibility for their actions
519,if a surgeon runs into difficulties during a surgery and hands over responsibility to someone else is the original surgeon liable for what the next person does or fails to do it depends was this a more qualified individual for this particular situation did they give the other person fair warning and a proper brief of the situation so there could be a graceful handover or did they drop the scalpel and run out of the room while shouting its your problem now a bleep from a self driving car in a tricky situation feels more like the latter to me
520,if a surgeon runs into difficulties during a surgery and hands over responsibility to someone else is the original surgeon liable for what the next person does or fails to do it depends was this a more qualified individual for this particular situation did they give the other person fair warning and a proper brief of the situation so there could be a graceful handover or did they drop the scalpel and run out of the room while shouting its your problem now a bleep from a self driving car in a tricky situation feels more like the latter to me
521,its pretty easy actually all items that are sold in this country need to pass a certain certification standard you simply write into the lawstandard what a car must be capable of doing to be fit for sale you simply regulate what is required of an automated car like all cars the vehicle must pass an mot this could also include software updates that comply with the standards therefore the company is responsible for the safety of these features while the user is responsible for ensuring the vehicle meets the standard agreed upon
522,read the article this relates to fully self driving cars which are approved by regulators to be self driving it does not relate to the current system of driving assistance where the driver remains responsible
523,yeah this makes me think of a pilot still being responsible if his plane crashes while on autopilot he still has to be attentive
524,easily the manufacturer will insure the car except they wont they wont have any need to insurance is useful for low risk catastrophically costly one offs where when something goes wrong its a struggle to pay for whatever it is from cash flow so for a person car crashes and house fires would be those things for the likes of ford and toyota however absorbing the cost of much much lower risk autonomous vehicle car crashes would be near negligible and so absorbed by routine cash flow we are still a couple decades away from autonomous vehicle safety reaching this point but eventually they will kill off the car insurance industry
525,we all know the insurers will double dip and say that both the manufacturer and driver need insurance throw in additional fees for the driver for handling claims just because
526,car insurance is compulsory due to the high rate of expensive accidents otherwise it wouldnt be needed it isnt compulsory for bikespramsroller skates because the rate of claims would be vastly exceeded by admin costs so yes with safe cars insurance could cease although probably wouldnt since old habits die hard
527,what do you think the payout rates of insurance companies are
528,you would have been responsible for stopping the car speeding up to mph if you are supposed to be supervising you must be supervising all of the time not just when an accident happens you would be responsible for ensuring not only that there isnt an accident but that the vehicle is driving safely if the car is doing up to a blind corner then you have failed to supervise
529,they used the persons background just to make her look bad i dont think the person was responsible the company was theres no way even if the person hadnt been looking at their cell phone that they could have avoided hitting the pedestrian nobody has reflexes like that not even a machine apparently
530,i think you are on the money with this comment there is no need for a company like toyota to pay a much smaller insurance company to take risk off its books there will be a place for re insurance i expect in the event of large scale issues imagine a large class action lawsuit due to a software glitch in the us
531,absorbing the cost of much much lower risk autonomous vehicle car crashes would be near negligible and so absorbed by routine cash flow really i find it hard to believe these large companies will open the doors to liability sure all the expected events are one thing but to open the door to the unforseen that itself could be catastrophic
532,if there were no car insurance youd be at risk of any idiot wrecking your valuable car and simply then losing it the ways of wrangling out of court claims are massive and they could have no assets anyway
533,okay ill re phrase that because to me it was clear we were talking about normal individual people you dont think car insurance should be a legal requirement for normal individual people and im asking about it currently not if extremely safe self driving cars become the norm also as of it seems like royal mail have some amount of third party liability car insurance too
534,okay ill re phrase that because to me it was clear we were talking about normal individual people you dont think car insurance should be a legal requirement for normal individual people and im asking about it currently not if extremely safe self driving cars become the norm also as of it seems like royal mail have some amount of third party liability car insurance too
535,right if the manufacturer is to take full legal responsibility for level then it makes sense as that suggests no human oversight at all is required otherwise its saying a human driver still has some responsibility
536,there will be a place for re insurance i expect in the event of large scale issues imagine a large class action lawsuit due to a software glitch in the us i doubt anyone would be willing to insure them for that though anything that would be too costly for toyota to bear would also be too big for an insurer to bear and the risk of that occurring would be unquantifiable
537,its legally needed so a base government level national insurance should cover the absolute basics the private entitys take over the additional extras courtesy cars private rehab and physio theft and damage government level just to cover health private for private needs and property
538,i think ultimately these responsibilities will delay the fully automated driving with these companies just trying to avoid that potential liability and we will end up with a lot of cars that could be classified as level but still retaining human controls to avoid the manufacturer taking that leap im not sure whats best a lot of drivers are already driving distracted so it may end up making things much safer even if its not ideal
539,the chinese ones in this vid have lidar whereas tesla are doing it all with video and some ultrasound i think i think we will have some level teething issues before level level is unambiguously the car companys responsibility
540,oh i dont know the reinsurance industry is extremely large they underwrite natural disaster policies which wouldnt be much different to what we are talking about maybe even larger
541,i think youre underestimating the capacity of the insurance industry and also the fact that quite often a large risk will be split up into sections and distributed across multiple insurers
542,unless theyve changed it you dont actually need insurance to drive you can give a bond instead which i think is k the text is in the road traffic act although it is possible it has been repealed and im not aware
543,so is that cost the same for everyone or based on a persons risk the absolute basics you mention i take it you mean third party damage or are you not including loss of income and care costs to third parties because i would say that that should be included in basic coverage that is the main cost of car insurance so although it is the basic amount that is needed it makes up most of the cost why is it different to say food sure that is not legally needed but clearly needed sustain life or do you think that should also be provided not for profit
544,but the person i replied to talked about insurance companies not being able to make you pay anymore and i asked if they thought car insurance shouldnt be compulsory like it is now
545,it will probably come down to the manufacturer wanting to market the vehicle as fully autonomous verses not wanting to take responsibility for crashes i guess they will see which one they belive will make the moat profit
546,okay well i agree a basic provision of good food from the government is not a bad thing i just think car insurance is not top of the list of things the government should provide but currently dont one problem is that if you charge everyone the same amount is moral hazard or maybe its called something else but high insurance costs keep certain drivers off the road if suddenly it cost the same or was free at the point of use for everyone then you could expect more bad drivers on the road and higher crashes and deaths if you do base it on risk similar to now the problem you get is that you will only get one price currently there are lots of companies offering a quote for you so what you may find is that it actually becomes more expensive for certain people thats because each insurance company currently takes a slightly different view on risk i get the point that if its legally needed why should there be a profit made from it thought but i think loads of things are needed to different degrees where profit is currently made
547,when a tesla hit a firetruck while on autopilot it accurately recorded what happened and how autopilot failed to recognize the firetruck the only reason the driver was responsible is because he had the ability to take over but did not do so because he was eating a fucking bagel behind the wheel
548,i dont know if there is a change of view they would have to retrofit lidar to all their cars if so the graphics i have seen of a teslas view of the roads look as impressive as those of waymo or baidhu that said i am just a little sceptical that anyone has managed to overcome the problem of a car driving at level able to deal with any ordinary driving occurrence but it needs to be able to safely transfer control with extreme reliability when something outside its experience happens
